,source,theme,title
193,NewsPicks編集部,1,【小山薫堂】自分に向いていないことをやる必要はない
194,Beyond,1,文科省が推進する「国際バカロレア」とは？グローバル教育の正解はどこにある
195,ライフハッカー［日本版］,1,眠かったら寝る。誰にでもすぐに使えて超強力な「勉強法」とは？
196,Business Insider Japan,1,学校は週1。「正解のない時代の子育て」に自らシェアハウス作った一家——学びはリビングでの交流から
197,Diamond Online,1,「好きなこと」を仕事にする人が不幸になりかねないワケ
198,HONZ,1,『NETFLIXの最強人事戦略 自由と責任の文化を築く』で働き方を見直す
199,ライフハッカー［日本版］,1,「上司が昇給の話をうやむやにする」への対処法
200,致知出版社編集部,1,【WEB限定連載】義功和尚の修行入門——体当たりで掴んだ仏の教え〈第6回〉
201,PR Table,1,日本企業がこれからも世界で活躍するために
202,ハフポスト日本版,1,文京区教育委員会による「障害児・家庭いじめ」と言える客観的な理由～「地域の学校に特別支援学級を設置して」請願を固辞
203,AMP[アンプ] - ビジネスインスピレーションメディア,1,部下の上司への評価は10点満点中5.6点。目標管理の調査からみる理想の上司像
204,ハフポスト日本版,1,AIやロボットに仕事を奪われない職場はかえってヤバイ、という話。 （武内俊介 税理士）
205,ハフポスト日本版,1,これからの社会に必要とされるのは、「きれいごと」を掲げる会社
206,ハフポスト日本版,1,サイボウズ式：「転職先、会話が少なくて寂しい……」と思いきや、オンラインがにぎやかだった
207,ハフポスト日本版,1,『500ページの夢の束』人は物語なくしては生きていけない
208,財経新聞,1,就活ルール廃止は「学生へのしわ寄せ」を避けてほしい
209,ITmedia ビジネスオンライン,1,女性の6割が「年下社員との接し方」で悩んだ経験あり　付き合い方のコツは……？
210,WWD JAPAN.com,1,英オールセインツCEOが退任　親会社のデジタル投資部門に異動
211,Forbes Japan,1,世界で最も革新的なリーダートップ10
212,BLOGOS - 最新記事,1,世界で最も革新的なリーダートップ10 - フォーブス ジャパン
213,共同通信,1,「信じたら手遅れ」就活ルール巡る学生の本音
214,共同通信,1,東工大が授業料を独自値上げへ　19年度、学部で「国立初」
215,東洋経済オンライン,1,若者がDA PUMP｢USA｣にポカンとするワケ
216,ひみつ基地,1,高卒の本来の可能性に蓋をする高卒就職・採用の5つの問題点とは？
217,Diamond Online,1,黒人保守派のソーウェルが アファーマティブ・アクションを否定する理由 [橘玲の世界投資見聞録] - 橘玲の世界投資見聞録
218,ギズモード・ジャパン,1,いや、マジな話、「AirPower」はどこへいったの？
219,ホウドウキョク,1,"依然1,600人避難　小学校再開も　北海道地震1週間"
220,スパークス・グループ,1,「バフェット・クラブの金言」⑮投資について(その6)
221,Forbes Japan,1,「VERY」編集長が語る、30〜40代女性のリアル
222,BLOGOS - 最新記事,1,就活ルールを廃止したら何がどう変わるの？と思ったときに読む話 - 城繁幸
223,FUJITSU,1,富士通が実践する「働き方改革」
224,朝日新聞デジタル,1,キーワードは「２人らしく」　手作り結婚指輪が人気
225,JBpress(日本ビジネスプレス) JBpress 最新記事,1,世界金融危機は誰のせいだったのか
226,ITmedia エンタープライズ,1,明治安田生命、保険商品の収支分析などにAIを活用――NSSOL提供の機械学習プラットフォーム「DataRobot」を導入
227,朝日新聞デジタル,1,「半分、青い。」ロケ地は「全部渋い」　岐阜恵那・岩村
228,BLOGOS - 最新記事,1,バイトの「バックレ」5人に1人が経験あり　勤務中に「退屈さ」を感じる人ほど離職を意識する傾向も - キャリコネニュース
229,MONOist,1,愛車の不調を憂えるのは、きっと今の時代だけのぜいたくな悩み
230,Forbes Japan,1,面接官が本当に聞きたい9つの言葉
231,リセマム,1,【大学受験】グローバル・国際系大学限定、高校生のための進学相談会9/23渋谷
232,Forbes Japan,1,「信用力」とは？　子供が図書館を通して学べること
233,FUJITSU,1,働き方改革を成功に導くファーストステップ～ビジョン策定～
234,PHPオンライン 衆知｜PHP研究所 ,1,もし島津斉彬が長生きしていたら、幕末史はどうなったか？ 八幡和郎（作家、評論家、徳島文理大学教授）
235,NewsPicks編集部,1,【のん】作品の質を上げるため、監督と議論する私の方法
236,ITmedia ビジネスオンライン,1,「社員を管理しない、評価しない」 個人と会社の幸せを追求した社長が心に決めたこと
237,Books&Apps,1,欧米の「つながらない権利」が徹底していてすごかった。
238,Diamond Online,1,2人に1人が転職する時代、「転職難民」にならないためには
239,HuffPost Japan,1,iPhoneはなぜガラケーを駆逐したのか。山口周さんが語る、働く人に必要な「美意識」
240,AERA dot. (アエラドット) ,1,「働き方改革」で管理職が悲鳴　広がる部下との労働時間格差
241,DANRO,1,普通のサラリーマンが始めた手作り「野外フェス」が8年目
242,PRESIDENT Online：「仕事人×生活人」のための問題解決塾,1,"英イートン校""統治者""を育てるヤバい授業 - 「君がカール大帝ならどうする」"
243,NewsPicks編集部,1,【小山薫堂】「普通の生活」とは何か？ 弟の分まで生きる
244,Diamond Online,1,英語は、文法や単語ではなく、 「パターン」と「塊」で覚えよう！ - たった30パターンで英会話！
245,朝日新聞デジタル,1,求む！とがった人材　ホワイトハッカー発掘へ協会を設立
246,Reuters,1,インタビュー：四半期開示やめると日本株離れも＝金融庁幹部
247,ITmedia NEWS,1,カドカワが「N中等部」開校へ　プログラミング学習など充実、「生徒が社会に出ていくための武器を育てる」
248,PRESIDENT Online：「仕事人×生活人」のための問題解決塾,1,副業で稼げる人、稼げない人の決定的違い
249,ITmedia ビジネスオンライン,1,独身男女に聞く「結婚したら住みたい街」、2位は横浜　1位はやっぱり……
250,ITmedia エンタープライズ,1,デジタル先進企業の従業員は「意欲」が高く「幸福感」も強い――Arubaが調査
251,ITmedia ビジネスオンライン,1,「おっぱいバレー」原作本を手掛けた出版社、破産　ヒット作が続かず
252,Social Game Info,1,【人事】DMM、元グノシー執行役員の松本勇気氏をCTOとして招聘
253,京都新聞,1,寂聴さん「あの世で自慢したい」源氏物語ミュージアムをべた褒め
254,京都新聞,1,ご長寿108歳男性、健康の秘訣は「なんでも食べて、のんびり」
255,京都新聞,1,滋賀の高校生でオンリー1の簿記1級合格　夢は公認会計士
256,リセマム,1,「強火」は使い時がカギ、家庭の炒飯をパラパラに
257,PR Table,1,すべての社員の「働きたい想い」を支える出産・育児支援制度
258,PHPオンライン 衆知｜PHP研究所 ,1,医学部に受かる人、落ちる人　カリスマ予備校講師が見つけた５つの違い 犬塚壮志（元駿台予備校化学講師、東京大学大学院生）
259,Social Game Info,1,Nianticとポケモン、『Pokémon GO』で「ウルトラボーナスイベント」開催　フリーザー・サンダー・ファイヤーが登場…21日からレイドバトルにミュウツーも！！
260,ハフポスト日本版,1,「夢は叶う」と思わせてくれた人たち　MALICE MIZER 25周年
261,BLOGOS - 最新記事,1,40代のモーレツ社員になった「僕」にプーさんが教えてくれたこと ~ユアン・マクレガー――クローズアップ~ - 猿渡 由紀 - 文春オンライン
262,ハフポスト日本版,1,投資なんて、すべきじゃない。
263,ハフポスト日本版,1,サイボウズ式：日本人は、会社にいる「時間」にこだわりすぎ。「時間＝責任」は学校文化の呪縛──田端信太郎×青野慶久
264,キャリコネニュース,1,「中高年のキーボード音が嫌で退社する新入社員」にマツコ「そんなやつ辞めちまえ！」
265,Social Game Info,1,【インタビュー】YouTuberタイアップ動画のクオリティをデータで磨く…GOODROIDに聞く動画マーケティング支援ツール「kamui tracker」の真価とは
266,京都新聞,1,チラリ見える貴族女性、源氏物語のドキドキ体感　京都・宇治
267,AMP[アンプ] - ビジネスインスピレーションメディア,1,“ミレニアル世代”は革新サービスによってワークスタイルを確立する。特徴的な5つのサービス
268,Diamond Online,1,メルカリをユニコーンにした人材採用術「差別化って“人”に尽きる」
269,NewsPicks編集部,1,【小山薫堂】「カノッサの屈辱」のアイデア出しと「屈葬睡眠」
270,マネー現代,1,人事評価で「上位5％」に入った人たちの働き方「驚きの共通点」
271,NewsPicks編集部,1,【ワースト】10年で年収が減った100社。ディズニー、ユニクロも
272,共同通信,1,国が学童保育30万人分を拡大へ　23年度までに、新プラン
273,Diamond Online,1,部下のパフォーマンスを下げる「ものの言い方」していませんか？
274,朝日新聞デジタル,1,本気で自殺を考えた人、６７％は１年後も　日本財団調査
275,NewsPicks編集部,1,【のん】楽しみながら最高を目指す。私の”変身”計画。
276,朝日新聞デジタル,1,幼児・高等教育の家計負担、日本は世界最高レベル
277,PR Table,1,英語の“壁”を取りはらう―― 英語学習サービスの企画者がプロダクトに込めた想い
278,Forbes Japan,1,小山薫堂が描く、理想的な老後の過ごし方
279,Forbes Japan,1,あなたが時間を無駄にしている原因は？　注意すべき7つの要素
280,共同通信,1,体操女子の畠田ら、早大合格　トップアスリート入試
281,WWD JAPAN.com,1,榮倉奈々が「トッズ」のジャパンアンバサダーに就任　キャンペーンムービーを制作
282,ITmedia ビジネスオンライン,1,就活で志望企業を嫌いになった学生は4割　「社員が偉そう」「オワハラ」はNG
283,ハフポスト日本版,1,JKが夏休みに最高の大人に出会った話
284,リセマム,1,都内中学生の性教育、避妊法・人工妊娠中絶の指導は9％
285,Reuters,1,インタビュー：財政拡大でリフレ再加速、増収分全て活用を＝ＳＧ証券・会田氏
286,時事通信社,1,金融危機が変えた生き方＝異業種・分野へ転身－リーマン・ショック１０年
287,Business Insider Japan,1,N高が中等部開校——「学校合わない」中学生20万人に“社会に出るための武器”を
288,共同通信,1,三浦新警視総監「期待に応える」　就任会見で抱負、テロ対策課題に
289,Forbes Japan,1,「パニクるな！」　岐路に立つテスラとイーロン・マスク
290,朝日新聞GLOBE＋,1,握手断ったら面接終了 ムスリム女性が勝訴
291,ハフポスト日本版,1,持続可能な社会をつくるため、高校生が課題解決を話し合った
292,ホウドウキョク,1,警視総監に三浦正充氏　東日本大震災など実績
293,NewsPicks,1,【落合陽一×平野啓一郎】日本人は自由をアップデートできるか
294,FASHIONSNAP.COM【ファッションスナップ・ドットコム】,1,スタートトゥデイ研究所、博士号取得を目指す人への支援制度を導入
295,致知出版社編集部,1,家系分析の第一人者・天明茂さんが説く、幸せな人生を送る秘訣
296,ZUU Online｜経済金融メディア,1,松下幸之助が全く売れなかった商品をヒットさせた方法とは
297,BLOGOS - 最新記事,1,避難所支える厚真町職員、「一時ではない継続支援を」 - オルタナS編集部（若者の社会変革を応援）
298,BCN＋R,1,プログラミング？　子どもに一体何を教えればいいんだ
299,BLOGOS - 最新記事,1,小林よしのり先生は意外に女性に対して？まとめは正しいけど具体策のためには女医が働きやすいシステム環境を！ - 中村ゆきつぐ
300,BLOGOS - 最新記事,1,【悲報】「健全なる精神は健全なる身体に宿る」ただの願望だった - MAG2 NEWS
301,BLOGOS - 最新記事,1,医療の進歩　でも高い！　医師が感じた治療費 - 中村ゆきつぐ
302,BLOGOS - 最新記事,1,「もっと友だちを見つけよう」を考える - 長谷川一
303,PRESIDENT Online：「仕事人×生活人」のための問題解決塾,1,"酒も飲まず""夜の銀座""に半世紀通った理由 - 情報収集に「金」を惜しむな"
304,ITmedia ビジネスオンライン,1,なぜ安室奈美恵は私たちの心を揺さぶり続けるのか？
305,BLOGOS - 最新記事,1,書評「告白」 - 城繁幸
306,BLOGOS - 最新記事,1,20世紀文明論（19）：生活革命①少子化・・・⑦ - 舛添要一
307,ハフポスト日本版,1,娘はかわいいし、幸せ。なのに苦しい。 産後うつと強迫性障害に苦しんだ2年半の記録
308,WWD JAPAN.com,1,ベイクルーズが40周年でスペシャルアイテム発売　「チャンピオン」や「フルーツオブザルーム」などとコラボ
309,Business Insider Japan,1,ほとんどの人が不得意で、最も過小評価されているスキルとは？
310,福井新聞オンライン,1,現在７７歳でドイツ文学者の池内紀…
311,BLOGOS - 最新記事,1,志田未来結婚！過去に語っていた「子供は28歳までに産みたい」 - SmartFLASH
312,GLOBIS 知見録 最新記事,1,リーダーシップ論はその捉え方が大事
313,NewsPicks編集部,1,【メルカリ】仕事の基準をトップに合わせ、自走できる組織を作る
314,NewsPicks編集部,1,【小山薫堂】「勝手にテコ入れ」習慣でアイデア体質になる
315,ex.yahoo.co.jp,1,テストの最終日、とんでもなくバズってしまった僕は、気がつけばサマソニのステージに立っていた
316,FNN.jpプライムオンライン,1,高校中退・元コギャル外交官  天国の母に捧げる一冊の本
317,NewsPicks編集部,1,【解説】東工大、日本初の「授業料値上げ」が意味すること
318,Business Insider Japan,1,3連休に成功者が実践している16のこと
319,Diamond Online,1,【年収１億円の習慣】会社まで「30分以内」で 通勤できる場所に住む
320,東洋経済オンライン,1,将棋･羽生善治竜王が｢弟子｣をとらない理由
321,Diamond Online,1,「残業ゼロ」を実現するために、今すぐ始めるべきシンプルな習慣
322,産経ニュース,1,都が高齢者就業支援を１０月始動　キャリア活用や職業訓練実施
323,DANRO,1,フリーランスは「アコムが友達」 ライター歴20年・渋井哲也さんが語る「お金」の話
324,産経ニュース,1,フランスが１兆円規模の貧困支援発表　貧困地区の学校で朝食を無償支給　義務教育は１８歳に延長
325,共同通信,1,地方議会の女性増に育休が有効　議長アンケート
326,BLOGOS - 最新記事,1,小室圭さんの母、パート先から姿消す　息子を追って渡米説も - NEWSポストセブン
327,Business Insider Japan,1,安室奈美恵がまとった孤独の正体。みんなの生きにくさを引き受け肯定してくれた25年
328,Diamond Online,1,なぜ、文書は、明朝体より ゴシック体・一枚がいいのか？
329,BLOGOS - 最新記事,1,なぜメンタルが強い人は「もうダメだ」を絶対に口にしないのか
330,@Engagement,1,新卒の定着率が23%から90%へ、ネットプロテクションズの「20%ルール」の使い方
331,NHKニュース,1,ＡＩで要らなくなる業種 “銀行 百貨店…” 就活学生の調査
332,リセマム,1,秋・冬のあったか煮物をさらにおいしく、そのコツは？
333,ギズモード・ジャパン,1,「忘れられる権利」は世界に広がるべきなのか
334,共同通信,1,芋煮を最多提供で世界記録、山形　3代目大鍋が大役
335,Market Hack,1,日本の大学が世界ランキングで低位に甘んじている本当の理由
336,BLOGOS - 最新記事,1,ザコシショウが明かす「パンツ一丁はタモリさんへのオマージュ」 テレビっ子・ハリウッドザコシショウさんインタビュー #2 - 文春オンライン
337,BLOGOS - 最新記事,1,ハリウッドザコシショウが一番尊敬する人「竹中直人さんを見て芸風が固まった」 テレビっ子・ハリウッドザコシショウさんインタビュー #1 - 文春オンライン
338,BLOGOS - 最新記事,1,水面下で蔓延しつつある液体大麻　常習者の身勝手な理屈 - NEWSポストセブン
339,ライフハッカー［日本版］,1,衣替えの季節にクローゼットの中身をすべて把握し、不要品を仕分けるコツ
340,BLOGOS - 最新記事,1,安楽死・尊厳死議論の最前線・1 - 山田太郎
341,BLOGOS - 最新記事,1,石破さんは、日本の安全保障に係る問題を徹底的に提起して総裁選後に備えられたら如何だろうか - 早川忠孝
342,ホウドウキョク,1,村上春樹さん最終候補を辞退　ノーベル“代替”文学賞
343,時事通信社,1,村上春樹氏、ノミネート辞退＝「ノーベル文学賞の代替賞」
344,朝日新聞デジタル,1,村上春樹さん、ノーベル賞代わりの文学賞ノミネート辞退
345,ライフハッカー［日本版］,1,NYのスタートアップ「Justworks」創業者が、生産的を高めるために意識していることとは？
346,ハフポスト日本版,1,「検索」が、子育て中の親を追い詰める。不安なママはどうすればいいのか
347,BLOGOS - 最新記事,1,錦野旦が告白「6年後にスター引退。近所に墓も買いました」 - NEWSポストセブン
348,NewsPicks編集部,1,【小山薫堂】やらずに後悔するより、やって後悔したほうがいい
349,商業界オンライン,1,お家ラーメンの太りにくい「10の食べ方」
350,NPコミュニティチーム,1,Takao Kiyotakaさんの「コメントで満たされる好奇心」
351,PHPオンライン 衆知｜PHP研究所 ,1,人生を後悔したくないなら、 今すぐ「趣味」を見つけなさい
352,GIGAZINE,1,「猫の楽園」を科学の発展のために作ってしまった大学
353,致知出版社編集部,1,「朝の読書」はこうして始まった――大塚笑子さんが語る「読書の力」
354,PRESIDENT Online：「仕事人×生活人」のための問題解決塾,1,たいてい「いい質問ですね」でうまくいく - ガンコ上司、生意気部下、不機嫌妻
355,Diamond Online,1,【年収１億円の習慣】「身だしなみ、挨拶、接遇」を徹底すれば、 問題の8割は解消する
356,マネー現代,1,クレジットカード、銀行口座、ATM…「頭のいい人」はこう使う
357,ライフハッカー［日本版］,1,完璧主義者は要注意？ 「アイデア負債」を抱える人の特徴と今すぐ返済する方法
358,現代ビジネス[講談社] | 最新記事,1,秋田の人口たった2600人の村が「学力日本一」になった秘密
359,NewsPicks編集部,1,【メルカリ】マネージャーに求められること。それは「信じる」こと
