,source,theme,title
0,Forbes Japan,1,「美味しい」は社会を変える力になる｜レフェルヴェソンス 生江史伸
1,朝日新聞デジタル,1,心のケア、相談が必要なケースとは　厚労省、ＨＰで紹介
2,PRESIDENT Online：「仕事人×生活人」のための問題解決塾,1,"28歳女性役員が""年下社員""に使った作戦 - 社員の7割は、挨拶すら無視した"
3,PRESIDENT Online：「仕事人×生活人」のための問題解決塾,1,年収300万円でも「リッチ」な人の考え方 - ヒントは「行動経済学」にあった
4,PRESIDENT Online：「仕事人×生活人」のための問題解決塾,1,"早大セクハラ「退職金返還拒否」の妥当性 - ""非難を受け、本人も反省している"""
5,ハフポスト日本版,1,アルツハイマー病になった人が、周りに知って欲しい5つのこと
6,NewSphere,1,ラジオ、ゲームセンターからスマホまで　親を心配させてきた“新しい娯楽”たち
7,The Coca-Cola Company,1,コカ･コーラ社社員が語る「空の上の幸福論」
8,ライフハッカー［日本版］,1,朝のルーティンがうまくいかない理由とその解決方法
9,ハフポスト日本版,1,35歳のサラリーマンが、夢のプロ棋士になった。愛と憎しみが生んだ「将棋界の奇跡」
10,ハフポスト日本版,1,「優雅な読書が最高の復讐である」。山崎まどかさんが実践する、本との向き合いかた
11,マッシュメディア,1,自宅がスタジオに! フィットネスクラスを受講できるスマートミラー「Mirror」が斬新
12,福井新聞オンライン,1,ノーベル文学賞を受賞した…
13,GLOBIS 知見録 最新記事,1,組織の成長に必要なのはリーダーが部下の変化を促すこと
14,GLOBIS 知見録 最新記事,1,人を育てることができる人を育てるために――メルカリの挑戦
15,JBpress(日本ビジネスプレス) JBpress 最新記事,1,作られた記憶、作られた体験がもたらす未来　記憶とは自分を自分たらしめる重大な構成要素だ
16,Career Supli（キャリアサプリ）｜あしたのシゴトが面白くなるウェブマガジン,1,退屈と決別しよう！人生がつまらない人のための方法！！
17,現代ビジネス[講談社] | 最新記事,1,どうしたら殺さずに済むか…サイコパスを自覚する男の「孤独と葛藤」
18,BLOGOS - 最新記事,1,一人でも国政を動かせることを証明したアントニオ猪木 - 天木直人
19,Forbes Japan,1,大切な人を亡くした悲しみ　その複雑な克服プロセスとは？
20,BLOGOS - 最新記事,1,今こそ見直そう！ スポーツボランティアの意味を - The BORDERLESS
21,朝日新聞デジタル,1,お産の「影」の中に描いた光　ＮＨＫ「予想以上の反響」
22,ライフハッカー［日本版］,1,特定のスキルを習得するためのアドバイス
23,朝日新聞デジタル,1,留学生の就職、門戸拡大へ　アニメ関連の職種追加も検討
24,BLOGOS - 最新記事,1,「週末に温泉でゆっくり」はむしろ疲れる - PRESIDENT Online
25,PRESIDENT Online：「仕事人×生活人」のための問題解決塾,1,"""丸腰""で他人に投資の相談をする人の末路 - 銀行も怖いが、親はもっと怖い"
26,PRESIDENT Online：「仕事人×生活人」のための問題解決塾,1,貯金が増えないなら、小遣いを2万増やせ - 家計は固定費を見直すことで改善
27,Social Game Info,1,スクエニ、『刀使ノ巫女 刻みし一閃の燈火』で「此花寿々花」誕生日を記念し「虹珠鋼×100個」をプレゼント　限定ボイスやトークも
28,ライフハッカー［日本版］,1,幸福度が上がる。今日から始められる7つの習慣
29,ハフポスト日本版,1,小島慶子さんが“イクメンクソ野郎”を描いた理由「イクメンがいいやつだと思うなよ」
30,Forbes Japan,1,費用対効果が低すぎる、現在の英会話教育
31,現代ビジネス[講談社] | 最新記事,1,ローマ帝国の栄枯盛衰に「日本の退化」を止めるヒントがある。
32,JBpress(日本ビジネスプレス) JBpress 最新記事,1,日本企業は、哲学がないまま生き残ってしまった　真山仁の経営論（1）日本企業が成長力を失った理由
33,現代ビジネス[講談社] | 最新記事,1,甲子園…あの夏のヒーローたちはまだ野球を続けているだろうか
34,現代ビジネス[講談社] | 最新記事,1,「発達障害者は仕事弱者だけでなく恋愛弱者でもある」と言える理由
35,現代ビジネス[講談社] | 最新記事,1,小説はオワコンか？　ふたりの知識人が語る「これからの文学」の定義
36,Diamond Online,1,犯罪被害者の権利を守る - 【名著】味読再読
37,致知出版社編集部,1,体の不調は不潔な部屋が原因だった――掃除の達人が教える病気を防ぐ掃除法
38,ライフハッカー［日本版］,1,いくつ当てはまる？ 慢性疲労の原因となる「副腎疲労度」チェックリスト
39,GQ JAPAN,1,谷中 敦「ファッションと音楽は相思相愛」──若き心の七人のサムライ紳士⑤
40,ライフハッカー［日本版］,1,復縁を繰り返すほど、関係は悪化する：研究結果
41,Forbes Japan,1,これからの時代「HOW」より「WHY」が重要な理由
42,Forbes Japan,1,ビル・ゲイツが推奨、「賢く学べる」4つの生涯学習サイト
43,とある投資家のαライフハック,1,働き方を変えれば企業価値が上がるという幻想
44,PRESIDENT Online：「仕事人×生活人」のための問題解決塾,1,「週末に温泉でゆっくり」はむしろ疲れる - 自律神経が整う24時間の過ごし方
45,NewsPicks編集部,1,【小山薫堂】普通じゃない家庭環境で自由に育つ
46,Diamond Online,1,外資系保険の全国トップセールスは なぜ、「逆さま」に文字を書くのか？
47,FNN.jpプライムオンライン,1,「失敗は忘れたらいい」69歳で起業したメガバンク元副頭取が若者に伝えたいこと
48,Diamond Online,1,他人に一生振り回される人の 「ダメな考え方」
49,Business Insider Japan,1,人気語学アプリのCEO、やる気のない社員を変えるシンプルな言葉
50,NewsPicks編集部,1,【堀江貴文】持ち家も賃貸も論外。僕はホテルに住む選択をした
51,東洋経済オンライン,1,嫌な人のことを考え続けるなんてムダすぎる
52,Forbes Japan,1,知識ではなく「知性」を磨いた人が生き残る
53,大人になってから学ぶサッカーの本質とは,1,ホリエモンが語る教育問題の本質　〜古い価値観を捨てることなしに教育は変わらない〜
54,BuzzFeed,1,47歳、今まで築いたモノを捨てて11年――伝説のポップスターの「その後」
55,ハフポスト日本版,1,「就活ルールが廃止されるとどーなるの？」と思ったときに読む話。 （後藤和也 大学教員、キャリアコンサルタント）
56,Social Game Info,1,韓国NGELGAMESとケイブ、新作オンラインRPG『デビルブック』の日本国内での配信契約を締結　キーマン2人にインタビューし、ゲームの魅力に迫る
57,ITmedia エンタープライズ,1,Alibabaのジャック・マー会長引退は2019年9月10日
58,ハフポスト日本版,1,「おやつ記者」は、インドで13年ぶりに正社員になった。駐在妻からの再出発で、考えたこと
59,BLOGOS - 最新記事,1,中国アリババの馬会長、2019年9月に退任　後任はチャンＣＥＯ - ロイター
60,PHPオンライン 衆知｜PHP研究所 ,1,従業員満足度が低い、後継者育成が進まない…人事が変われば経営は良くなる 南和気（SAPジャパン株式会社 人事・人財ソリューションアドバイザリー本部 本部長）
61,GQ JAPAN,1,鳩山由紀夫「アルマーニを着た政治家」──若き心の七人のサムライ紳士⑥
62,共同通信,1,アリババの馬会長が退任へ 中国IT大手、1年後に
63,AMP[アンプ] - ビジネスインスピレーションメディア,1,「できそこないがエリートと戦うには思考しかなかった」——SUPPOSE DESIGN OFFICE 谷尻誠
64,EE Times Japan,1,「就活」の在るべき姿を考える
65,リセマム,1,Z会「10歳までに身に付けたい考える力」を鍛えるワーク3冊刊行
66,共同通信,1,米CBSトップが辞任　セクハラ疑惑で調査
67,Diamond Online,1,iDeCoで人気の投資信託ランキング（2018年8月） SBI証券「iDeCo口座」の購入金額ランキングと、 積み立てできる投資信託の騰落率ランキングも発表！ - iDeCo（個人型確定拠出年金）おすすめ比較＆徹底解説
68,ホウドウキョク,1,車の運転中にヒヤッとしたことありませんか？車の故障は簡単な“アレ”で防げる
69,Social Game Info,1,【インタビュー】モバイルゲーム運営市場は2020年に1000億円規模に拡大…ゲーム運営業界のトッププレイヤーであるファンプレックスが見る今後の市場展開と運営移管の実情
70,BLOGOS - 最新記事,1,【8月米雇用統計】貿易戦争で米経済は崩れるか？ 不安な夜は「戻り売り」で＝ゆきママ - MONEY VOICE
71,FC今治,1,【参加者募集】「リーダーとしての自分」になるための5日間プログラム
72,TechCrunch Japan,1,プリシラ・チャン、インタビュー――移民の両親の苦闘からチャン・ザッカーバーグ基金のビジョンまで
73,Diamond Online,1,会社とは何のためにあるのか【孫泰蔵】 - 孫家の教え
74,教育問題の解決方法を考える,1,笑いのある授業を行うには、どうすればよいか - 教育問題の解決方法を考える
75,現代ビジネス[講談社] | 最新記事,1,副業のリスクを心配する管理職に「複業研究家」が伝えたいこと
76,ITmedia ビジネスオンライン,1,転職活動の「企業研究」はどうしている？　1万人に聞いた結果は……
77,Business Insider Japan,1,就活ルール廃止は本気か？人事が危惧する長期化とミスマッチ増。学生側は内定格差が拡大？
78,日経ビジネスオンライン,1,起業のリスク。精査してみると「こんなもんか」　マネーフォワード辻社長が語る「起業のリアル」
79,Diamond Online,1,「社会がこうなったら面白い」を実現するのが、自分の生き方
80,WWD JAPAN.com,1,中国インフルエンサー戦国時代　“かわいいだけじゃ生き残れない”市場で先陣を切る5人の共通点
81,NewsPicks編集部,1,【小山薫堂】軍隊のような寮生活が人生に与えた影響
82,NewsPicks編集部,1,【のん】大人のルールってなんだ。私はやりたいことをやる
83,Business Insider Japan,1,下積み嫌う若者たちへ。一見平凡な仕事に意味見つければ仕事の成果は変わる
84,Business Insider Japan,1,新潟から週2回東京に出勤、サイボウズの複業採用社員に聞く複業ライフのリアル。
85,Business Insider Japan,1,｢転職バブルは人材業界のマーケティング｣本当に転職すべき層は2割ほど——何を変えたいのかを明確に
86,Business Insider Japan,1,公務員が兼業したら社会は変わる？本業にいい影響は出るのか？
87,Business Insider Japan,1,東京とシドニー2拠点で日本の工芸を売る28歳。政府系職員という安定捨てた想いとは
88,Business Insider Japan,1,一風堂接待でエンジニア｢囲い込み｣メルカリ、LINEも進出の福岡市
89,Business Insider Japan,1,“プレゼンの神”澤円とシリコンバレー起業家育成のプロとが語るキャリア論、｢日本ではcrazyさへの応援が足りない｣
90,Business Insider Japan,1,初任給40万円の中国企業、ファーウェイで働く日本人の“履歴書”
91,Business Insider Japan,1,大企業からダダ漏れする“下積みレス”願望世代——20代でキャリアの地盤つくりたい
92,Business Insider Japan,1,日本郵政の正社員の処遇切り下げは合理的か——同一労働同一問題の本質を考える
93,Business Insider Japan,1,入社前から社内給与格差——年功序列ぬるま湯社員が陥る転職の壁
94,Business Insider Japan,1,｢日本型雇用は終わった、退職金なんていらない｣という人たちへの反論——“退職手切れ金”をすべての若者に
95,Business Insider Japan,1,｢最初の仕事はくじ引きである｣新卒配属ガチャ問題をどう乗り越えるか？
96,Business Insider Japan,1,女性4人に1人しか地元に戻らない豊岡市。プチ勤務や女性の自尊心アップ作戦
97,Business Insider Japan,1,外資金融で働く社員の1日に密着——チャレンジする人に、チャンスがある
98,Business Insider Japan,1,増加するパワハラ労災認定——あなたのその不調は上司ストレスでは？メンタルだけでなく、体調も
99,Business Insider Japan,1,海外経験なしでシンガポールで就職。パラレルキャリアから独立するまで
100,Business Insider Japan,1,日大アメフト部、日本ボクシング連盟……事件続発でも｢体育会系人材はやっぱり貴重｣と言える理由
101,Business Insider Japan,1,Yahoo!アカデミア流、組織のリーダーシップを最大化する決定的な｢ある手法｣
102,Business Insider Japan,1,転職は慎重に。でも転職活動は積極的にした方がいい3つの理由
103,Business Insider Japan,1,フリーランスの落とし穴。自由な働き方実現のために見出した“ゆるいチーム”という選択
104,Business Insider Japan,1,ミレニアル世代の仕事・お金観を知る｢5つの問い｣——｢欲しいものがない｣は本当か？
105,Business Insider Japan,1,20代国家公務員の6割強が｢兼業したい｣——“忖度”生むキャリアの一本道を避けるためにも公務員は外に出よう
106,Business Insider Japan,1,激変する中国人留学生のアルバイト事情。今や人手不足日本の救世主——就労時間制限超えが常態化
107,Business Insider Japan,1,ミレニアル世代6割が関心持つ｢スラッシュキャリア｣って？収入以上に大事なこととは
108,Business Insider Japan,1,｢キャリアプランなんていらない論｣は本当か？確かにプラン通りにいく人は稀だが…
109,Business Insider Japan,1,これまで通りの｢新人研修｣を止めたら、新人がもっと成長した話。
110,Business Insider Japan,1,今の会社にいてもいいの？ベストセラー『転職の思考法』著者と一緒に考えよう！【イベント開催】
111,Business Insider Japan,1,事後報告で転職離婚、年収100万減でブロック…家族の反対で内定辞退の現実
112,Business Insider Japan,1,消える一般職、事務職正社員の需給ミスマッチ——｢価値生まない仕事｣は自動化される
113,Business Insider Japan,1,時間が足りないと悩んでいるあなたへ。この3つの方法で“無駄な仕事”はなくなる
114,Business Insider Japan,1,時給4000円派遣で復職、50代主婦の正社員採用…転職バブルで家庭との両立夢みたけど
115,Business Insider Japan,1,礼儀2.0問題に一言｢でも若い人も、たいがいおっさんじゃないですか？｣
116,Business Insider Japan,1,トップコンサルとVCが語る、次世代リーダーに必要な｢BTCスキル｣とは？
117,共同通信,1,現行就活ルール21年卒は維持を　企業側の指針廃止に大学側が見解
118,時事通信社,1,ＩＷＣ総会の焦点を聞く＝有識者インタビュー
119,NewSphere,1,時代が“タフでかっこいい”おばあちゃんを求めてる？ 脚光浴びる「バッドアス・グランマ」
120,リセマム,1,大学中退者の2人に1人、就職を考えずに中退…将来に不安
121,ハフポスト日本版,1,9歳の時、庭にできた巨大キャベツを見て、飢えに苦しむ人を救うNPOを作った女性がいる
122,共同通信,1,21年卒就活ルール「現行維持を」と大学側
123,BLOGOS - 最新記事,1,大坂なおみ 全米オープン 優勝！日本選手初の偉業！ - 松田公太
124,BLOGOS - 最新記事,1,出版業界から取次がなくなったら？ - ヒロ
125,Social Game Info,1,グリー、カナダのIUGO社の投資有価証券の売却で約10億円の売却益を計上　売却は資産の効率化および財務体質向上のため
126,PRESIDENT Online：「仕事人×生活人」のための問題解決塾,1,"元銀座No1ホステス""男性を手玉にする技"" - すぐ使える「秘密の4フレーズ」"
127,リセマム,1,【中学受験2019】2019年入試予測、受験者数は5年連続増の可能性
128,BLOGOS - 最新記事,1,中国アリババの馬会長、19年9月に退任　後任はチャンＣＥＯ - ロイター
129,ライフハッカー［日本版］,1,個人に最適化された｢睡眠｣を実現する方法とは？
130,日刊工業新聞 電子版,1,ＮＰＯ法人アスヘノキボウ、起業家志望者を中小派遣　２年間経営修行
131,ハフポスト日本版,1,在宅での看取りにむけて　結論を急ぐことはありません
132,リセマム,1,【中学受験】日能研、小1-3女子親子向け学校説明会…名古屋9/30
133,共同通信,1,学校に根本的原因と報告書で指摘　いじめ相談の新潟高1男子自殺
134,Forbes Japan,1,沈黙すべきか、言うべきか　職場で声を上げるべき時と方法
135,Social Game Info,1,スクエニ、『刀使ノ巫女 刻みし一閃の燈火』でタワー型イベント「精鋭特務部隊研究棟」を開催！　刀使の使用制限など特別ルールが
136,PHPオンライン 衆知｜PHP研究所 ,1,間宮林蔵　樺太が島だと発見した有能役人は、50歳を越えてから隠密に転身？ 日本史・あの人の意外な「第二の人生」より
137,朝日新聞デジタル,1,東日本大震災７年半　旧大川小で「忘れないでいたい」
138,Social Game Info,1,『ポケモンGO』で「ウルトラボーナスイベント」を9月14日より開催！　伝説のポケモンが次々登場！　「ミュウツー」も伝説レイドバトルに！？
139,ハフポスト日本版,1,コーヒーからコンドーム、根性論まで。あなたの知らないフィンランド、伝えます
140,京都新聞,1,終活「できること始めて」　相続争い起きやすいパターンも
141,BLOGOS - 最新記事,1,"東大が""結婚したくない大学""で1位のワケ - PRESIDENT Online"
142,ITmedia ビジネスオンライン,1,採用した人材が「すぐ辞める」「活躍しない」……人事の悩み、どうすれば解決できる？
143,BLOGOS - 最新記事,1,大坂なおみ 日本語はラップで…注目集める独特すぎる勉強法 - 女性自身
144,PRESIDENT Online：「仕事人×生活人」のための問題解決塾,1,"東大が""結婚したくない大学""で1位のワケ - 20代未婚女性300人に聞きました"
145,リセマム,1,スマートシティとプログラミング教育の関係とは？PTA会長のエンジニアパパが解説（6）
146,WIRED.jp,1,ファッションの歴史は尊い。未知の世界は、楽しい。──中里唯馬
147,ライフハッカー［日本版］,1,アフリカ系女性向け美容製品会社「Sundial Brands」のオーナー、リシュリュー・デニスさんの仕事術
148,Bloomberg,1,アリババ会長の名言集－優秀な集団率いるのに「愚か者」が必要な理由
149,Business Insider Japan,1,経団連「東京五輪のために採用前倒し」計画が、就活ルール廃止にすり替わった本当の理由
150,ライフハッカー［日本版］,1,思春期女子の「自己肯定感」を下げないための対応法
151,ライフハッカー［日本版］,1,「あなたの弱点は何？」面接官がよく聞く意図とは
152,新R25,1,初対面では相手の名前を連呼。起業家けんすうの「人見知りのためのビジネスTips」
153,Forbes Japan,1,部下のやる気はどこにあるのか？
154,Diamond Online,1,2児の母ながら海外出張もこなす、秘訣は「朝食」と「夕食」にあり
155,NewsPicks編集部,1,【小山薫堂】人は最良の人生を選択しながら生きている
156,ひみつ基地,1,学力テストの結果を校長や教員のボーナス、学校予算に反映する危険
157,NewsPicks編集部,1,【のん】下手くそでもいい。私は真っ直ぐにいきたい
158,Diamond Online,1,偏差値35から東大合格、現役東大生が教える読書術
159,朝日新聞デジタル,1,災害時「生活不活発病」に注意　心身の働き低下
160,Forbes Japan,1,ヤンキーたちとつくる「移動と遊び」の新しい教育のかたち #30UNDER30
161,AMP[アンプ] - ビジネスインスピレーションメディア,1,「優秀な人材」より「早期退職しない人材」の方が面接に有利。人事担当の気になる実情とは
162,共同通信,1,老後の生活、月27万円必要　敬老の日で生保調査
163,リセマム,1,"平成30年司法試験、1,525人が合格…最低年齢は19歳"
164,Forbes Japan,1,アスリートも実践するマインドトレーニングとは〜コンサドーレ札幌 都倉賢
165,ライフハッカー［日本版］,1,まだ毎日1万歩にこだわってるの？
166,Forbes Japan,1,腹の括り方を学んだ「社長の羅針盤」
167,PRESIDENT Online：「仕事人×生活人」のための問題解決塾,1,外国人の名刺を机に並べるとバカにされる - 「記憶力が悪い人」だと思われる
168,BuzzFeed,1,あなたにぴったりの学問はなに？ 京大「診断」の背景に「タコツボ化」への危機感
169,マイナビニュース,1,社長の輩出率、4年連続1位の都道府県は?
170,フィットするビジネスを考えるコーポレートメディア | クラシコムジャーナル,1,マッチョな競争から降り、「コーポレートブランディング」を楽しむと何が起きるか？──hey 佐藤裕介×クラシコム 青木耕平対談 前編
171,BLOGOS - 最新記事,1,80歳からでも成長はできる！“脳を老化させない4つの習慣” - 女性自身
172,AMP[アンプ] - ビジネスインスピレーションメディア,1,"約7割が「職場でのLGBT施策なし」。LGBT約1,600人への調査"
173,BLOGOS - 最新記事,1,若者の7割「地域限定社員で働きたい」　「ペットの飼育があるので転勤は難しい」「いつ転勤するか分からない状態は落ち着かない」 - キャリコネニュース
174,Social Game Info,1,スクエニ、『星のドラゴンクエスト』で「転生」3回目を9月13日メンテナンス終了後より実装へ
175,BLOGOS - 最新記事,1,DVとそうでない境目をつらつらとくだらなく考えてみる - 永江一石
176,リセマム,1,【大学受験】東大や一橋などが参加「首都圏国公立大学合同説明会」11/18-25
177,Forbes Japan,1,批判的なフィードバックをうまく受け止める4つのコツ
178,Social Game Info,1,スクエニ、『刀使ノ巫女 刻みし一閃の燈火』で「ダンまち」特別コラボイベントと限定ピックアップ招集第2弾を開始！
179,ハフポスト日本版,1,アスペルガー症候群の夫を持つ漫画家が語る、心身の不調「カサンドラ症候群」とは
180,朝日新聞デジタル,1,左遷は不遇か　人生ムダにする３カ条　生保創業者の戒め
181,リセマム,1,いつもの「干物」をランクアップ、秘密はグリルにあり
182,PR Table,1,働きたい人と仕事をつなぐ採用マーケターの醍醐味
183,ライフハッカー［日本版］,1,最初の「10分間」だけ頑張ろう。「ランニング」が辛くて挫折しそうなときの対処法
184,Social Game Info,1,Pokémon Koreaが現地時間9月14日より「Pokémon Festa」を開催　『ポケモンGO』で普段は韓国で出現しないポケモンと出会えるチャンス！
185,ITmedia エンタープライズ,1,ファーストキャリアの選び方　「会社選び」「部署選び」に、失敗した！ と思ったら
186,リセマム,1,デル・ピエロが講師として来場…新卒学生向け就活イベント「キャリスポ」9/22
187,WIRED.jp,1,自分の可能性を評価されるなら、相手は人工知能くらいがちょうどいい
188,BLOGOS - 最新記事,1,「お金の使い方」についても「人体実験」してみます - 内藤忍
189,Diamond Online,1,トップ営業マンに「オタク」が多い理由
190,NewsPicks編集部,1,【のん】お金を稼ぐのは大変、軸をぶらさず仕事する私のやり方
191,Medium,1,僕がサンフランシスコで学んだ5つのこと
192,The Pyramid,1,メルカリ・小泉社長による『 1→100の組織設計を丸裸にする』人事組織（HR）勉強会の備忘録
