,source,theme,title
0,時事通信社,5,北海道地震、需給逼迫なら計画停電も＝週明けに１割節電必須－政府
1,京都新聞,5,琵琶湖の水、台風で北に移動　南湖の水位1ｍ低下
2,朝日新聞デジタル,5,反移民政党支持の自動投稿が急増　スウェーデン総選挙
3,共同通信,5,官房長官、死者21人と発表　心肺停止は6人、不明13人
4,朝日新聞デジタル,5,トランプ氏、３０兆円の対中高関税に言及　同盟国も脅す
5,ホウドウキョク,5,北朝鮮が最新ITをアピール　海外メディアに公開
6,Forbes Japan,5,「超富裕層」人口の世界一は香港、日本の2都市もトップ10入り
7,朝日新聞デジタル,5,北海道に生活物資など財政支援へ　今年度予算の予備費で
8,京都新聞,5,社説：経産省の指示　公文書の意義を損なう
9,京都新聞,5,社説：北海道全停電　一極集中のもろさ露呈
10,共同通信,5,猪木氏、北朝鮮高官と会談　核や拉致問題提起か
11,ホウドウキョク,5,トランプ氏｢大変な問題になる｣　貿易協議に日本をけん制
12,PRESIDENT Online：「仕事人×生活人」のための問題解決塾,5,年収300万円でも「リッチ」な人の考え方 - ヒントは「行動経済学」にあった
13,共同通信,5,被災地の生活支援へ予備費投入　首相「切れ目なく供給」
14,福井新聞オンライン,5,工場内に可燃物、消火作業長期化　敦賀・東洋紡火災
15,ハフポスト日本版,5,文筆家の菅野完氏、日本人女性への傷害罪でアメリカで起訴。裁判に出廷せず、20年間「逃亡」状態に
16,朝日新聞デジタル,5,イラク南部でデモ暴徒化　隣国イランの総領事館襲撃
17,ホウドウキョク,5,『10秒でふりかえる10年前』【自民党総裁選に麻生氏、石破氏、小池氏らが出馬(2008年9月8日)】
18,時事通信社,5,イラン領事館に放火＝デモ隊が暴徒化－イラク
19,共同通信,5,北海道地震で予備費支出を10日決定と首相
20,朝日新聞デジタル,5,首相、北海道視察後の取材応じず　総裁選の質疑避ける？
21,共同通信,5,柔道、故斉藤仁氏の次男が初V　全日本ジュニア体重別選手権
22,ホウドウキョク,5,北海道地震 死者39人に　安倍首相、被災地を視察
23,時事通信社,5,韓国政府がＭＥＲＳ対策会議＝李首相「失敗を反面教師に」
24,共同通信,5,ソウルで日韓文化交流行事　「友情を未来へ」、多彩な公演
25,共同通信,5,日中関係「新発展遂げた」　唐元国務委員、正常化を評価
26,時事通信社,5,「反移民」極右伸長か＝スウェーデン総選挙の投票実施
27,時事通信社,5,「交流大切」「共に平和構築を」＝ソウルで日韓おまつり
28,京都新聞,5,京都・福知山市が避難勧告　大雨で土砂災害の恐れ
29,共同通信,5,首相が土砂崩れ現場視察、北海道　地震の被災者を激励
30,朝日新聞デジタル,5,「タンカー避難失敗なければ…」　松井知事、衝突に怒り
31,共同通信,5,スウェーデン総選挙投票始まる　極右政党の議席増が焦点
32,共同通信,5,モスクワ市長選、現職が再選へ　プーチン氏側近
33,共同通信,5,松井知事、万博支持要請で欧州へ　台風復旧対応の中、出発
34,共同通信,5,米、ベネズエラ軍不満分子と接触　クーデター計画、米紙が報道
35,PRESIDENT Online：「仕事人×生活人」のための問題解決塾,5,"70歳以上は損""高額療養費制度""の新基準 - 「影響を受ける人はごく一部」だが"
36,共同通信,5,オバマ氏、初の応援演説　「政治に健全さ取り戻す」
37,朝日新聞デジタル,5,「あと１０年ぐらいで国のトップに」　国民民主・玉木氏
38,朝日新聞デジタル,5,北海道の生乳工場、９割近くが再開　残る５カ所も準備
39,共同通信,5,北海道地震死者42人と首相　関係閣僚会議で
40,朝日新聞デジタル,5,オバマ氏、中間選の接戦区で始動「市民が立ち上がろう」
41,朝日新聞デジタル,5,北海道地震、死者４２人に　政府、予備費５億円超使用へ
42,WIRED.jp,5,英国で消えゆく小銭、危機感を抱くホームレスの人々
43,共同通信,5,首相、北海道の土砂崩れ現場視察　予備費5億円支出決定へ
44,NewsPicks編集部,5,【菅義偉】「国を動かす人事」たった一つの基準
45,FNN.jpプライムオンライン,5,豚コレラウイルス検出　農林水産省、豚肉の輸出停止
46,NHKニュース,5,トランプ大統領「アップルは米国に工場を」強気の姿勢崩さず
47,ハーバー・ビジネス・オンライン／最前線ビジネスパーソンの『知りたい』に応えるビジネスメディア,5,小泉進次郎氏、自民党総裁選での「石破氏支持」を講演会で匂わせる!?
48,NewSphere,5,深刻化するアメリカの教師不足　フィリピンなど外国人の採用進むも賛否
49,Reuters,5,焦点：中国がリンクトインで超攻撃的スパイ作戦、米高官が指摘
50,www.afpbb.com,5,10月に大麻解禁のカナダ、軍が厳しい使用制限令を発令
51,共同通信,5,総裁選、安倍氏支持が党員6割超　3選が濃厚、石破氏追う
52,共同通信,5,北朝鮮建国70年で軍事パレード 弾道ミサイルなし
53,産経ニュース,5,転居や相続手続き、ネットで一括申請　臨時国会の目玉「デジタルファースト法案」
54,情報速報ドットコム,5,今年から事実上の妊娠税 、突然の妊婦加算に驚きの声！「逆に安くしろよ」「安倍政権何してんの」
55,Aviation Wire,5,関空、国交省が復旧プラン　運営会社主導に“見切り”
56,ニュースイッチ,5,“空飛ぶクルマ”や“キャッシュレス”政府の１９年度注力事業をまるっと紹介
57,LIMO,5,労働力不足なら最低賃金の引き上げは妥当
58,琉球新報,5,虚構のダブルスコア　知事選、出回る「偽」世論調査
59,共同通信,5,安倍首相、ロシア大統領今夕会談　極東ウラジオに出発
60,時事通信社,5,与野党とも過半数届かず＝「反移民」極右は伸長－スウェーデン総選挙
61,時事通信社,5,７月経常黒字、２兆９７億円＝輸入額増加が影響、１４％減
62,時事通信社,5,ＧＤＰ改定値、年３％増に上方修正＝設備投資好調、２年ぶり伸び－４～６月期
63,共同通信,5,安倍首相、ウラジオストクへ出発
64,soae.info,5,「こうのとり7号機」打ち上げ延期　天候悪化予測のため
65,共同通信,5,北方領土問題解決へ前進したいと首相
66,共同通信,5,五輪マスコット、児童と交流　福岡の小学校訪問
67,Reuters,5,ロシア全土で反年金改革デモ、警察が800人超拘束＝人権団体
68,共同通信,5,プーチン氏側近が圧勝　モスクワ市長選で再選
69,ハフポスト日本版,5,「就活ルールが廃止されるとどーなるの？」と思ったときに読む話。 （後藤和也 大学教員、キャリアコンサルタント）
70,Reuters,5,ジョンソン前英外相、メイ氏のＥＵ離脱案は「自爆チョッキ」と批判
71,朝日新聞デジタル,5,韓国特使団の徐氏、安倍首相と会談　「できる貢献する」
72,Reuters,5,中国8月ＰＰＩ、伸びが減速　ＣＰＩは予想上回る
73,Reuters,5,韓国特使団が北朝鮮との会談を説明、日米韓の連携確認＝官房長官
74,NewSphere,5,教員の銃武装、連邦政府からの補助金を使用してもよい　米教育長官
75,福井新聞オンライン,5,就活ルール廃止案に学生不安の声
76,Reuters,5,ギリシャ、財政目標達成へ　年金削減・増税は不要に＝首相
77,Reuters,5,7月経常収支は2兆0097億円の黒字＝財務省
78,沖縄タイムス＋プラス,5,名護市議選挙：与野党が拮抗　野党１減も辺野古反対は過半数
79,日本経済新聞,5,中国、地方の隠れ債務「500兆円」の憂鬱
80,NewsPicks編集部,5,【最終話・菅義偉】私の半生、3つのターニングポイント
81,Bloomberg.com,5,ゴールドマンが推計－日銀の異次元緩和なき長期金利のあるべき水準
82,this.kiji.is,5,学校エアコン、寄付頼みの行政　安易な次善策「公の責務放棄」
83,AFP,5,トランプ氏が金氏に謝意、建国記念パレードで核誇示せず
84,共同通信,5,パリ協定の実施ルールで対立残る　国連気候変動会議が閉幕
85,朝日新聞デジタル,5,安倍氏、改憲は「使命」　石破氏「政府を謙虚に」
86,共同通信,5,道内10日から2割節電呼び掛け　11日も計画停電回避へ
87,Reuters,5,ＧＤＰ改定値、4─6月期は年率＋3.0％に上方修正　持ち直し鮮明
88,共同通信,5,北朝鮮、弾道ミサイル登場せず 建国70年記念日、中朝友好誇示
89,ZUU Online｜経済金融メディア,5,基本はリボ払い、借金に抵抗ナシ??アメリカ人の消費性向から米国景気を読み取る
90,日本経済新聞,5,政治家たちの揮毫（写真でみる永田町）
91,日本経済新聞,5,自民党総裁選、論戦スタート　安倍・石破両氏が所見を発表
92,日本経済新聞,5,首相、平和条約締結「前進したい」　ロシアへ出発
93,日本経済新聞,5,リーマン危機10年、責任不在　次の危機の芽
94,日本経済新聞,5,災害現場で移動型ＡＴＭが活躍　西日本豪雨でも
95,日本経済新聞,5,日経イベンツガイド
96,日本経済新聞,5,Versant
97,日本経済新聞,5,日経テレコン
98,日本経済新聞,5,日ロ首脳が領土問題協議へ　首相、総裁選へ成果狙う
99,日本経済新聞,5,九商連、ベトナム商議所と覚書締結へ　経済交流促進
100,日本経済新聞,5,首相がロシアへ出発　領土問題など協議
101,日本経済新聞,5,自民・小泉氏、総裁選の支持明かさず
102,日本経済新聞,5,ローソン銀行発足、セブンに17年遅れの勝算は
103,日本経済新聞,5,首相、日朝首脳会談に重ねて意欲　韓国特使と会談
104,日本経済新聞,5,パリ協定ルールで隔たり、削減目標や資金支援　国連作業部会
105,日本経済新聞,5,４～６月期実質ＧＤＰ、年率3.0％増に上方修正
106,Business Insider Japan,5,クマすら恐れる男？ ロシアの国営テレビがプーチン大統領を褒め讃える新番組をスタート
107,Business Insider Japan,5,"""アメリカの英雄""ジョン・マケイン氏が残した勇気、幸福、祖国に関する10の名言"
108,Business Insider Japan,5,トランプ関税効果絶大！｢今夏、中国でレクサスがバカ売れ｣から日本が学ぶこと
109,Business Insider Japan,5,だから北朝鮮は激怒している！ トランプ大統領は、金正恩委員長に朝鮮戦争の終結宣言を約束していた
110,Business Insider Japan,5,米中貿易戦争は長期化の様相——中国ハイテク製品狙い撃ちで安全保障で全面的｢敵対｣へ
111,Business Insider Japan,5,杉田問題は安倍一強問題。｢力｣ある人に認められるウットリ感が暴走させる感覚
112,Business Insider Japan,5,なぜ杉田水脈議員は過激発言を繰り返し“出世”したのか──女性が女性を叩く構図は誰が作ったか
113,Business Insider Japan,5,アメリカ人が考える、最も偏向した／公平なニュースメディア・ランキング
114,Business Insider Japan,5,4日に1回ペース？ トランプ大統領はゴルフを愛しすぎている
115,Business Insider Japan,5,今年は何かが違う！ ロシアのプーチン大統領、シベリアで短い休暇を楽しむ
116,Business Insider Japan,5,機能不全に陥る安倍｢インド太平洋｣戦略 ——冷淡なインドという誤算、米中の板挟みに
117,Business Insider Japan,5,｢一人っ子政策｣で人口時限爆弾を招いた中国、解消に躍起
118,Business Insider Japan,5,トルコ通貨ショックの深刻度は？エルドアン政権がEUの生殺与奪を握る理由とは
119,Business Insider Japan,5,非核化はどうなる？ アメリカ、北朝鮮に核の放棄を求めるが、北朝鮮の答えは｢ノー｣
120,Business Insider Japan,5,｢コチコチの愛国者ほど国をダメにする者はいない｣半藤一利氏が若い世代に伝える
121,Business Insider Japan,5,最大で2万人の留学生とその家族がカナダを去ることに？ サウジアラビア、人権問題をめぐってカナダと関係悪化
122,Business Insider Japan,5,スパイ活動し放題？ サンフランシスコは中国の諜報機関にとって｢天国｣だった
123,Business Insider Japan,5,北朝鮮では、10人に1人が｢現代の奴隷｣として働かされている —— 最新レポート
124,Business Insider Japan,5,カナダ・オンタリオ州の新政権、世界最大規模のベーシックインカム実験を打ち切る
125,Business Insider Japan,5,何が出てくる？ ウォーターゲート事件を暴いたジャーナリスト、今度はトランプ政権の内幕本を出版へ
126,Business Insider Japan,5,中国への関税発動、アメリカの真の狙いは｢中国製造2025｣計画の阻止だ
127,Business Insider Japan,5,薬物はダメ！ 取り締まりを強化する中国、個人の排泄物を含む下水を分析して容疑者特定へ
128,Business Insider Japan,5,消滅可能性都市から｢日本一子育てしやすい街｣へ。豊島区改革推進する元マイクロソフト女性公務員
129,Business Insider Japan,5,ホームレス問題は制御不能か、ビフォアアフター写真で見る現状
130,Business Insider Japan,5,非武装地帯を｢平和地帯｣に！ 韓国、北朝鮮との軍事境界線に配置している部隊を｢試験的に｣削減へ
131,Business Insider Japan,5,40℃超でも原発なき首都圏の電力が足りてる理由 —— 2020年東京五輪でひっ迫リスクは？
132,Business Insider Japan,5,朝日新聞はなぜこんなに嫌われるのか——｢権力批判はメディアの役割｣という幻想の終わり
133,Business Insider Japan,5,水筒もエアコンもプール授業の上着も禁止、外遊び強要…熱中症軽視する小学校の過酷な夏ルール
134,Business Insider Japan,5,｢暴力的で弱いものいじめばかり ｣ オバマ前大統領、男性を批判し、女性の更なる政治参加を呼びかけ
135,Business Insider Japan,5,ドレスの裾が長すぎる！ 中国で警察が少数民族の女性の服を切って回る
136,Business Insider Japan,5,国交、総務、農水でも若手官僚ペーパー続々。若手の起こす地殻変動は日本を変えるか。
137,Business Insider Japan,5,危険な“人口時限爆弾”、日本はやや回復、アメリカは危険な状態に
138,Business Insider Japan,5,11枚の写真で振り返る、アメリカとドイツの驚くほどの関係変化
139,Business Insider Japan,5,【独占】経産大臣が檄を飛ばす官僚働き方改革。ペーパーレス、国会対応前倒し、テレワーク…やれば徹夜はなくせる
140,共同通信,5,現行就活ルール21年卒は維持を　企業側の指針廃止に大学側が見解
141,共同通信,5,カンボジア野党党首1年ぶり保釈　外交日程前に融和強調か
142,Reuters,5,メイ英首相のＥＵ離脱案、与党分裂の一因に＝元離脱担当副大臣
143,Reuters,5,9月ユーロ圏投資家センチメント指数は低下、貿易摩擦など重し
144,時事通信社,5,最有力候補、遊説中に暗殺未遂＝腹部刺され重傷－ブラジル大統領選
145,時事通信社,5,反トランプ匿名寄稿に衝撃＝閣僚ら相次ぎ否定－米
146,時事通信社,5,中国、対米黒字が過去最大＝貿易戦争激化へ－８月
147,時事通信社,5,トランプ大統領弾劾の動き加速も＝米中間選挙で民主、下院逆転なら
148,北海道新聞 どうしんウェブ,5,小松道議が辞職　釧路町長選出馬へ
149,ホウドウキョク,5,安倍 VS 石破 演説会で火花党員票どうなる
150,共同通信,5,郵便局でカード決済導入へ　20年2月から、電子マネーも
151,共同通信,5,セクハラ問題で町長が辞意、群馬　議会不信任、解散策も不発
152,共同通信,5,少数連立の公算大、スウェーデン　新政権発足への協議難航
153,共同通信,5,国民、11日に新執行部を発足　統一選、参院選へ結束確認
154,時事通信社,5,国会議長らに同行要請＝南北首脳会談で韓国政府
155,ホウドウキョク,5,安倍首相「正恩氏と話すとき来た」　韓国要人と面会で
156,BuzzFeed,5,安倍VS石破 総裁選で二人が見せた5つの違い
157,時事通信社,5,街角景気２カ月ぶり改善＝８月、猛暑が押し上げ－内閣府
158,時事通信社,5,米特別代表、韓国外相らと会談＝非核化で協力確認
159,時事通信社,5,イドリブ空爆、既に３万人避難＝政権軍攻勢強める－シリア
160,時事通信社,5,化学兵器使用なら「強力な報復」＝対シリア、英仏とも合意－米補佐官
161,時事通信社,5,米国、１１月に成果目指す＝貿易問題でＥＵと閣僚会談
162,時事通信社,5,連立交渉、難航必至＝極右政党が影響力行使も－スウェーデン総選挙
163,朝日新聞デジタル,5,２回目の米朝首脳会談「年内の可能性」　米大統領補佐官
164,朝日新聞デジタル,5,北朝鮮が博覧会　化粧品・ニンジン茶…ロシアで販売中
165,時事通信社,5,米朝首脳「大胆な決断を」＝核廃棄で韓国大統領
166,財経新聞,5,輸入関税引き上げと新たな減税策
167,朝日新聞デジタル,5,国民の新幹事長に平野博文・元官房長官
168,ホウドウキョク,5,安倍氏外交 vs 石破氏地方遊説　自民党総裁選
169,ホウドウキョク,5,正恩氏 米朝首脳会談求める親書　米側も「調整開始」
170,ホウドウキョク,5,日ロ首脳　北方四島共同経済活動　進め方で一致も領土問題は不透明
171,時事通信社,5,朝鮮半島和平で協力確認＝韓国・インドネシア首脳
172,北海道新聞 どうしんウェブ,5,厚真火発の全面復旧１１月以降　経産相　１号機は今月末以降
173,共同通信,5,危険なため池、廃止検討も　広島県、豪雨の復旧復興方針
174,共同通信,5,日韓で北朝鮮の非核化へ連携　慰安婦問題には適切に対応
175,毎日新聞,5,米国：トランプ政権　ＳＮＳ各社に圧力
176,時事ドットコム,5,通知守らぬ自治体は対象外＝ふるさと納税見直しへ－野田総務相
177,共同通信,5,欧州にとって「歴史的」　スウェーデン極右躍進
178,Reuters,5,米加州、2045年までに100％クリーンエネルギーに　知事が署名
179,時事ドットコム,5,豊洲開場、正式決定＝斎藤農水相が認可、来月１１日に－東京都
180,産経WEST,5,戦闘機も高齢化社会　進む軍用機の“寿命”延長計画　次はＡＩ
181,Reuters,5,安倍首相、北朝鮮経済協力は拉致解決が不可欠　日ロ首脳会談で
182,日本経済新聞,5,太陽光発電、買い取り価格半減へ　経産省方針
183,スポーツ報知,5,都と渋谷区も検討開始…代々木公園多目的アリーナ計画
184,NHKニュース,5,世耕経産相「苫東厚真火力発電所の全面復旧は11月」
185,Reuters,5,金正恩氏、第2回米朝首脳会談を要請　トランプ大統領に書簡
186,Estonian Mania,5,電子政府エストニアが抱える、日本では報じられない民族問題。
187,共同通信,5,日本の教育公的支出は最低　15年のOECD調査
188,Reuters,5,独ＺＥＷ景気期待指数、9月は－10.6に改善　現況指数も上昇
189,朝日新聞デジタル,5,首相動静―９月１１日
190,共同通信,5,8.2億人、飢えに苦しむ　子供の発育阻害と国連
191,朝日新聞デジタル,5,ニッポンレンタカー、２４時間営業廃止へ　年内にも
192,時事通信社,5,金正恩氏、終戦宣言へ直接説得狙う＝米朝首脳再会談提案－「南北」で側面支援も
193,朝日新聞デジタル,5,司法試験合格、最少の１５２５人　完全移行の１２年以降
194,共同通信,5,ツイッター裁判官「表現行為できなくなる」
195,朝日新聞デジタル,5,「行けやボケ」客から暴言など…サービス業の７割が経験
196,共同通信,5,総裁選、石破氏が論戦中断に不満　安倍氏はロシア訪問
197,共同通信,5,世界金融危機の再来に警鐘　債務増大で前ECB総裁
198,共同通信,5,中ロ貿易、1千億ドルの見通しとプーチン氏
199,時事通信社,5,「一帯一路」で日本に期待＝中国大使、内外情勢調査会で講演
200,共同通信,5,ウラジオストクで北朝鮮見本市　制裁下の経済協力示す
201,NewsPicks Brand Design,5,ノーベル賞受賞者に聞く。人を動かす言葉の力
202,日本経済新聞,5,郵便配達、平日だけに　人手不足対応で総務省検討
203,NHKニュース,5,「中野サンプラザ」 区長 計画どおり取り壊す方針を示す
204,Diamond Online,5,中国がアフリカ支援外交で打ち出した「5つのノー」の真の狙い
205,Reuters,5,米下院共和党、新たな減税策を発表　中間選挙控え
206,共同通信,5,人手不足関連の倒産、最多更新　8月に45件、民間調査
207,朝日新聞デジタル,5,安倍首相、議員票の８割超を確保する情勢　朝日新聞調査
208,時事通信社,5,国際刑事裁の判事訴追も＝軍要員捜査許さず－米高官
209,Reuters,5,第2四半期のユーロ圏就業者数、前期比＋0.4％・前年比＋1.5％
210,ハフポスト日本版,5,「マタニティハラスメント」訴えた裁判、判決で会社に女性への慰謝料命令
211,Reuters,5,英賃金、5―7月は前年比+2.6％　予想上回る
212,時事通信社,5,米朝首脳再会談の提案支持＝中国
213,朝日新聞デジタル,5,司法試験合格、最少の１５２５人　新試験の０６年以降
214,福井新聞オンライン,5,福井工大福井、攻撃の手緩めず
215,朝日新聞デジタル,5,立憲、参院選にＬＧＢＴの候補擁立へ　枝野代表が方針
216,Reuters,5,ユンケル欧州委員長、ＥＵは国際舞台で能力発揮すべきと主張へ
217,時事通信社,5,大企業景況感、２期ぶりプラス＝製造、非製造業とも改善－７～９月
218,朝日新聞デジタル,5,死者の人数、政府が再び修正　道庁認定に合わせ４１人に
219,共同通信,5,ベトナム「犬や猫を食べないで」　ハノイ市当局が市民に要請
220,共同通信,5,ガソリン、3年9カ月ぶりの高値　153円台、供給減懸念で
221,Reuters,5,ＲＣＥＰの年内成立に確信持てず＝シンガポール首相
222,Reuters,5,貿易における保護主義、「断固として拒否」すべき＝中国副首相
223,共同通信,5,ガソリン、3年9カ月ぶり高値
224,Reuters,5,ユンケル欧州委員長、ユーロの国際的役割拡大呼び掛けへ
225,ホウドウキョク,5,日中首脳“北”など協議　米中貿易戦争も意見交換か
226,時事通信社,5,米、ＩＳ掃討で最終段階＝シリア北東部で地上作戦
227,時事通信社,5,米、イランに「断固たる対応」＝在イラク公館攻撃で警告
228,時事通信社,5,日米欧、２５日に貿易相会合＝対中国連携へＮＹ開催で調整
229,財経新聞,5,7月JOLT求人件数は最高水準を記録
230,時事通信社,5,南北連絡事務所、１４日に開所式＝「非核化協議にも寄与」と韓国
231,Bloomberg.com,5,トランプ大統領の2670億ドル対中関税、米消費者の「全身」を直撃へ
232,Reuters,5,ロシア、ソ連崩壊後で最大規模の軍事演習を極東で開始　中国も参加
233,ニュースイッチ,5,地域住民がＡＩによる問い合わせサービスを自治体に求める理由
234,共同通信,5,米、また環境規制緩和方針　石油採掘時のメタン漏れ
235,西日本新聞,5,統計所得、過大に上昇　政府の手法変更が影響
236,Reuters,5,焦点：政府、自動車関連減税など対策検討へ　消費増税・日米交渉にらみ
237,共同通信,5,安倍首相10月訪中で一致　習氏「歓迎」と表明
238,共同通信,5,英中銀総裁の退任延期　20年1月、EU離脱に対応
239,産経ニュース,5,玉城デニー氏、寄付金１２０万円を不記載　政治資金規正法違反か　選挙区内に花代も
240,共同通信,5,企業の景況感、2四半期ぶり上昇　7～9月、設備投資好調
241,日本経済新聞,5,日本と中国、なぜいま改善？　３つのポイント
242,日本経済新聞,5,トランプ流交渉術　首相は油断禁物
243,日本経済新聞,5,リーマン危機10年現場を歩く マネーに沈んだ北の小国
