,source,theme,title
244,日本経済新聞,5,安倍首相、ロシアの夜は大学で（写真でみる永田町）
245,日本経済新聞,5,さよなら霞が関、郵政が大手町移転　脱官業は道半ば
246,日本経済新聞,5,ロシア大統領、年内の平和条約締結求める
247,日本経済新聞,5,首相が来月訪中へ　日中首脳会談、対北朝鮮で連携
248,日本経済新聞,5,「東京でも首相演説会」甘利氏、自民総裁選で
249,日本経済新聞,5,日米貿易協議、２１日で調整　茂木氏とライトハイザー氏
250,日本経済新聞,5,首相「日中協力、地平線広がる」　日中首脳会談
251,日本経済新聞,5,景況感２期ぶりプラス　大企業７～９月、製造・非製造とも改善
252,日本経済新聞,5,360度カメラでのぞく自民党総裁選
253,共同通信,5,対ハンガリー制裁提案を採択　強権姿勢巡り欧州議会
254,Reuters,5,伊「五つ星運動」が経済相辞任要求との報道、国債利回り上昇
255,Reuters,5,中国新規人民元建て融資、8月は1.28兆元に減少　予想下回る
256,Reuters,5,ユーロ圏鉱工業生産、7月は前月比-0.8％　予想以上の落ち込みに
257,共同通信,5,EU委員長、国際社会主導に意欲　「強力な欧州」と施政方針演説
258,共同通信,5,ロヒンギャ帰還へ支援　日ミャンマー外相会談
259,共同通信,5,EU、焼酎輸入の規制緩和　一升瓶の使用可能に
260,ホウドウキョク,5,「年末までに平和条約締結を」　“無条件”プーチン氏提案
261,朝日新聞デジタル,5,北朝鮮へ先制攻撃「鼻血作戦」　トランプ氏暴露本で判明
262,致知出版社編集部,5,人口減少は国家存亡の危機と認識せよ――プーチン大統領のロシアに学ぶ少子化対策
263,時事通信社,5,米、信用に値せず＝核合意離脱は「無責任」－イラン駐日大使
264,時事通信社,5,難民抑制へ国境管理強化＝ネット上のテロ対策も－欧州委員長
265,リセマム,5,【高校受験2019】広島県公立高校、募集定員120人減
266,朝日新聞デジタル,5,首相動静―９月１２日
267,時事通信社,5,スウェーデン、男女平等どう実現？＝大使館、税制から探る討論会
268,NewSphere,5,子供にアメリカ国籍を　ロシア人、中国人に「フロリダ出産」「LA出産」が人気
269,ハフポスト日本版,5,ボコ・ハラムに拉致され、妊娠させられた女性たちの苦難
270,時事通信社,5,中国「米は内政干渉」＝新疆の人権問題提起に反発
271,Reuters,5,ユーロを基軸通貨に＝ユンケル欧州委員長
272,毎日新聞,5,ＥＵ：夏時間、来年廃止へ　欧州委・法案提示
273,BuzzFeed,5,玉城デニー氏を批判する「沖縄知事選サイト」が複数出現 デザインは公式風、管理者は同一人物？
274,AFP,5,韓国と北朝鮮、14日に南北連絡事務所を開設
275,Reuters,5,安倍首相、北朝鮮との会談に意欲　「私自身が直接対話すべき」
276,Reuters,5,ロシア大統領、安倍首相に年末までの平和条約締結を提案
277,共同通信,5,中国、通商協議再開受け入れ　貿易摩擦巡り、米提案で
278,共同通信,5,「押し買い」で所得隠しか、大阪　11億円、会社グループ
279,共同通信,5,自民、取材への対応に自粛要請　総裁選で各都道府県連に
280,共同通信,5,特別児童手当で支給漏れ、厚労省　10人分の88万円
281,共同通信,5,大極殿院の北門を確認、藤原宮跡　奈良・橿原、排水で苦労も
282,NewsPicks Brand Design,5,行動経済学とテクノロジーは社会課題にどう向き合うか
283,共同通信,5,北海道地震を激甚災害指定見込み　首相、閣僚会議で表明
284,朝日新聞デジタル,5,政府、北海道地震を激甚災害指定へ
285,Reuters,5,中国への海外直接投資、1─8月は前年比+2.3％＝商務省
286,共同通信,5,記者実刑「表現の自由関係ない」　スー・チー氏
287,共同通信,5,北海道地震を激甚災害に指定見込みと首相
288,ホウドウキョク,5,沖縄県知事選　事実上一騎打ち　辺野古移設どうなる
289,ホウドウキョク,5,“突然の平和条約提案”に静観構え　ロシア副首相は回答求める発言
290,朝日新聞デジタル,5,台湾なのに…人民元が流通、中国旗はためく島
291,時事通信社,5,７月機械受注、３カ月ぶりプラス＝省力化投資が堅調
292,朝日新聞デジタル,5,【詳報】佐喜真氏「所得向上」　玉城氏「辺野古認めぬ」
293,Reuters,5,来年5月の欧州議会選挙、極右会派が議席数増加へ
294,時事通信社,5,韓国次官「南北、新たな時代に」＝１４日に連絡事務所開所式
295,JBpress（日本ビジネスプレス）,5,中国の「債務の罠外交」の危うさ ノーと言える国になったマレーシア、マハティール首相に学ぶ教訓
296,共同通信,5,ロシア、「平和友好条約」念頭か　過去に提案
297,読売新聞,5,高齢者事故多く「安全サポート車」限定免許検討
298,日本経済新聞,5,電子たばこ「全面禁止も」　米ＦＤＡ  10代への販売規制をメーカーに要請
299,Reuters,5,機械受注7月は前月比＋11％で2年半ぶり大幅増、外需も回復
300,共同通信,5,米、対中閣僚級協議再開を提案か　数週間中と報道
301,Forbes Japan,5,EUの「リンク税」導入案、来年1月に成立か　反対派は猛抗議
302,Reuters,5,焦点：台風・地震被害で7─9月期ＧＤＰマイナスも、2段階の補正編成構想
303,共同通信,5,北朝鮮、ICBM関連施設解体か　米分析サイト
304,リセマム,5,東工大、授業料10万円値上げ…標準額超す
305,共同通信,5,総裁選、大票田の東京で駆け引き　安倍、石破陣営
306,朝日新聞デジタル,5,貿易戦争が多国間主義脅かす　河野外相、米中念頭に懸念
307,朝日新聞デジタル,5,首相動静―９月１３日
308,Reuters,5,トルコ大統領、中銀の独立性を主張　高金利には依然反対
309,共同通信,5,中国、車突入の死者11人に　男を拘束、「悪質な事件」
310,共同通信,5,河野氏「文句言う筋合いでない」　プーチン大統領発言
311,時事通信社,5,南北、１４日に準備協議＝文大統領「保有核廃棄を」
312,時事通信社,5,対日けん制か挑発か＝プーチン氏平和条約提案の真意
313,時事通信社,5,ロシア爆撃機がアラスカ接近＝防空識別圏内、米軍機が緊急発進
314,共同通信,5,AKB、タイ首相とポーズ　「恋チュン」でダンス
315,共同通信,5,文氏、北朝鮮に非核化へ行動要請　米国にも措置求め仲介役に意欲
316,共同通信,5,緩和で総資産膨張1600兆円　日米欧の3中銀、3～5倍に
317,朝日新聞デジタル,5,石破氏、短編小説で発信「クリエーティブさを競うべき」
318,共同通信,5,日ロ平和条約交渉再開へ調整　首相、プーチン氏と駆け引き
319,共同通信,5,上越新幹線、上野手前で緊急停止　非常ブレーキが作動
320,Reuters,5,現行の貿易制度は完璧でない、改革必要＝中国外相
321,Reuters,5,中国固定資産投資、過去最低の伸び　鉱工業生産は予想上回る
322,時事通信社,5,ハリソン・フォードさん環境保護訴え＝温暖化対策の国際会議－米
323,Reuters,5,領土問題を解決し、平和条約締結のため日ロ交渉進める=安倍首相
324,朝日新聞デジタル,5,【詳報】自民党は自由か？　安倍氏と石破氏が論争
325,時事通信社,5,大型ハリケーン、米南東部に上陸へ＝１００万人超に避難命令
326,リセマム,5,H35年度の都内公立小中学生数…小学校は約2.4万人、中学校は約1.5万人増の予測
327,京都新聞,5,社説：プーチン発言　意図や背景冷静に探れ
328,朝日新聞デジタル,5,プーチン氏の平和条約提案　首相「必要だという意欲」
329,共同通信,5,競技時間に漁業者が抗議　セーリング五輪テスト大会
330,Reuters,5,中国不動産投資・販売、8月は伸び鈍化
331,Reuters,5,安倍首相「異次元緩和ずっと続けていいと考えない」、総裁選討論会で
332,ホウドウキョク,5,日ロ平和条約締結へ「意欲」　石破氏はロシア外交に苦言
333,共同通信,5,三重県、議員定数削減案を否決　現行の51から減らさず
334,Reuters,5,米下院歳入委、個人向け減税の恒久化法案を可決
335,共同通信,5,中国の固定資産投資、最低更新　景気安定策を強化へ
336,朝日新聞デジタル,5,開城工業団地内の南北連絡事務所が開所　首脳会談前に
337,共同通信,5,中国、1～8月の固定資産投資が最低更新
338,Reuters,5,トルコ中銀、政策金利24.00％に引き上げ　追加引き締めも示唆
339,産経ニュース,5,安倍首相「新しい国造りに挑戦」　石破氏「日本が残るよう全力」　自民総裁選討論会
340,共同通信,5,仏、貧困対策に1兆円投入へ　大統領、支持率浮揚図る
341,Reuters,5,ＥＣＢ、量的緩和終了の軌道外れず　10月から買い入れ半減
342,毎日新聞,5,日本維新の会：創始者・橋下氏が新著「維新、失敗だった」
343,NHKニュース,5,”社員への配慮が収益向上に” 労働経済白書が分析
344,NHKニュース,5,“科学技術強国”中国の躍進と日本の厳しい現実
345,Forbes Japan,5,行動経済学とテクノロジーは社会課題にどう向き合うか
346,トラベルボイス,5,EUの「リンク税」導入案、来年1月に成立か　反対派は猛抗議
347,共同通信,5,富裕層が「思いっきり消費する旅行」とは？　インバウンド消費拡大のためにできることを考えた【コラム】
348,JBpress（日本ビジネスプレス）,5,ロシア、「平和友好条約」念頭か　過去に提案
349,日本経済新聞,5,中国の「債務の罠外交」の危うさ ノーと言える国になったマレーシア、マハティール首相に学ぶ教訓
350,The Wall Street Journal,5,電子たばこ「全面禁止も」　米ＦＤＡ  10代への販売規制をメーカーに要請
351,日立製作所,5,リーマン危機10年、なぜブッシュ氏に注目すべきか
352,朝日新聞デジタル,5,自民、ＬＧＢＴ議連に回答せず　「生産性ない」発言で
353,共同通信,5,野党、発言への首相対応を問題視　閉会中審査を引き続き要求
354,NewSphere,5,プーチン大統領はなぜいつも遅刻するのか？ 今回は2時間半待たされた安倍首相
355,共同通信,5,9条改憲の進め方で舌戦　自民総裁選討論会
356,時事通信社,5,危機対策の副作用顕在化＝新興国からマネー逆流－１５日、リーマン破綻１０年
357,Reuters,5,個人所得、10年で3─5割伸ばしていく＝討論会で自民・石破氏
358,朝日新聞デジタル,5,主要企業の夏のボーナス、過去最高の８７万円
359,朝日新聞デジタル,5,台風襲った文化財　北野天満宮「対応追いつかない」
360,時事通信社,5,「メディアは敵」は危険＝トランプ大統領を批判－アマゾンＣＥＯ
361,AMP[アンプ] - ビジネスインスピレーションメディア,5,在日中国人による“中国人向けクチコミ”サービス。中国人視点のプロモーションが可能に
362,JBpress(日本ビジネスプレス) JBpress 最新記事,5,「映っているのは我々」　ロシア元スパイ毒殺未遂の容疑者たち
363,ホウドウキョク,5,安倍VS石破 討論会　自民党総裁選
364,京都新聞,5,紅葉シーズン迫るも、台風21号で…京都の社寺、被害深刻
365,リセマム,5,【高校野球】秋田・金足農業の戦績、週刊朝日増刊でグラビア掲載
366,Reuters,5,中国不動産投資、8月は鈍化　アナリストは急減速予想せず
367,朝日新聞デジタル,5,アマゾンＣＥＯ「メディア攻撃は誤り」トランプ氏念頭に
368,Reuters,5,インタビュー：財政拡大でリフレ再加速、増収分全て活用を＝ＳＧ証券・会田氏
369,毎日新聞,5,北海道地震：節電目標、１割に引き下げ　最終調整
370,Bloomberg,5,安倍首相、異次元緩和「ずっとやっていいと全く思ってない」
371,BBCニュース,5,トランプ氏、プエルトリコのハリケーン死者数を裏付けなく否定　民主党のせいに
372,NHKニュース,5,EUの「リンク税」導入案、来年1月に成立か　反対派は猛抗議
373,毎日新聞,5,“科学技術強国”中国の躍進と日本の厳しい現実
374,トラベルボイス,5,日本維新の会：創始者・橋下氏が新著「維新、失敗だった」
375,日立製作所,5,富裕層が「思いっきり消費する旅行」とは？　インバウンド消費拡大のためにできることを考えた【コラム】
376,時事通信社,5,交渉決裂なら英経済混乱＝ＥＵ離脱で警告－中銀総裁
377,北海道新聞 どうしんウェブ,5,野田総務相、厚真や清田区里塚を視察
378,朝日新聞デジタル,5,台湾の駐大阪代表が自殺　関空封鎖時の対応で批判相次ぐ
379,共同通信,5,鑑真テーマに日中の学生交流　出身の揚州で座談会
380,Reuters,5,ＥＣＢ理事会の決定、非常に緩やかな正常化示唆＝ベルギー中銀総裁
381,Reuters,5,トルコ大統領、来年の地方選で民族主義者行動党との連合検討
382,朝日新聞デジタル,5,首相、年金開始７０歳超「３年で」　金融緩和出口も言及
383,時事通信社,5,南北首脳会談、生中継へ＝文氏は空路で平壌入り－準備協議
384,時事通信社,5,中国、投資減速止まらず＝過去最低の伸び－１～８月
385,Reuters,5,ユーロ圏労働コスト、第2四半期は約6年ぶりの大幅な伸び
386,共同通信,5,イタリアの高架橋、潮風で腐食か　遠い再建、崩落1カ月
387,共同通信,5,首相、金融緩和の正常化に意欲　「任期中に道筋」、副作用配慮
388,Reuters,5,焦点：暴落後も個人に人気のトルコリラ、東京市場で主要通貨入り
389,Reuters,5,次期ＥＣＢ総裁、仏出身者起用を支持─エッティンガー欧州委員＝独紙
390,朝日新聞GLOBE＋,5,各国の言い分を「宣伝戦」と引いた眼で見る　池内恵氏の「中東を読むヒント」
391,産経ニュース,5,北海道停電が示す日本の６重苦　国際環境経済研究所理事・竹内純子
392,NHKニュース,5,行動経済学とテクノロジーは社会課題にどう向き合うか
393,Forbes Japan,5,“科学技術強国”中国の躍進と日本の厳しい現実
394,毎日新聞,5,EUの「リンク税」導入案、来年1月に成立か　反対派は猛抗議
395,共同通信,5,大型ハリケーンが米南東部に上陸　100万人に避難命令
396,朝日新聞デジタル,5,米国の北朝鮮担当が来日　拉致被害者家族と面会
397,朝日新聞デジタル,5,首相動静―９月１４日
398,朝日新聞デジタル,5,大阪市教委、教員評価に全国学力調査の結果を反映へ
399,共同通信,5,タイ、政治活動一部解禁　民政移管へ前進
400,共同通信,5,米代表、拉致被害者家族と面会　「帰国できるよう全力」
401,共同通信,5,ロシア、3年9カ月ぶり利上げ　ルーブル防衛で7.5％に
402,朝日新聞デジタル,5,小泉進次郎氏、支持候補明かさず「単純な問題じゃない」
403,朝日新聞デジタル,5,首相、日ロ「１１・１２月の会談が重要」大統領発言受け
404,ホウドウキョク,5,ホウドウキョク30秒ニュース 9/10（月）～ 9/14（金）【(9/10)安倍首相「憲法改正に取り組むとき」石破氏「防災省必要」総裁選論戦スタート～】
405,朝日新聞デジタル,5,「川越市議からセクハラ」女性職員、市長へ再発防止要請
406,共同通信,5,ロシア中銀が3年9カ月ぶりに利上げ
407,財経新聞,5,大幅利上げでトルコリラ相場は安定するか？
408,Forbes Japan,5,日本維新の会：創始者・橋下氏が新著「維新、失敗だった」
409,共同通信,5,政府「北朝鮮非核化へ費用負担」　日米協議で伝達
410,soae.info,5,今週末はレッドブル・エアレース 第6戦ウィナー・ノイシュタット　DAZNで室屋選手を応援しよう！
411,共同通信,5,安倍・石破両氏そろって地方遊説　京都で防災、地方創生巡り論戦
412,共同通信,5,柔道の故斉藤仁氏らが殿堂入り　五輪2連覇で
413,京都新聞,5,地価上昇、いつか来た道　ホステル開業、元信金マンの懸念
414,ホウドウキョク,5,24時間連絡が可能に　南北連絡事務所が開設
415,京都新聞,5,地方創生や災害対応で論戦　安倍・石破氏、京都で演説会
416,京都新聞,5,市民の無料拝観券で不正横行　大津、発行方法変更したら利用激減
417,京都新聞,5,社説：パリ協定ルール　合意を目指し交渉急げ
418,時事通信社,5,「見苦しく、前例ない」＝ケリー氏とイラン外相の会談－米国務長官
419,福井新聞オンライン,5,アミューズが全員オーディション
420,Reuters,5,トルコは「経済的攻撃」の矢面、米の批判で＝エルドアン大統領
421,朝日新聞デジタル,5,台風２１号にめげず　岸和田だんじり祭、始まる
422,PRESIDENT Online：「仕事人×生活人」のための問題解決塾,5,自宅で親を看取るにはどうすればよいか - 「人生100年時代」に向けた施策
423,京都新聞,5,社説：総裁選討論会　盛り上がらぬ政策論戦
424,共同通信,5,非国家でパリ協定をけん引　米の気候行動サミット閉幕
425,朝日新聞デジタル,5,老後の頼りは年金より就労収入　２０～４０代の意識調査
426,時事通信社,5,トランプ大統領に批判相次ぐ＝気候行動サミットが閉幕－米
427,共同通信,5,米、対中関税発動を準備　22兆円、大統領指示と報道
428,Diamond Online,5,福岡は日本のシリコンバレー!?東京にない、すごいポテンシャルとは
429,日本経済新聞,5,1人当たり所得増減マップ あなたのまちは？
430,共同通信,5,日本、IWC脱退を警告　総会、商業捕鯨の再開否決
431,時事ドットコム,5,安倍内閣支持４１％、不支持を逆転＝辺野古移設賛成３割弱－時事世論調査
432,共同通信,5,北海道、節電目標取りやめ　連休明け18日から、経産相表明
433,Diamond Online,5,「アホノミクス」が今以上に長引けば日本経済は“窒息死”する - ＤＯＬ特別レポート
434,共同通信,5,元選対本部長が捜査協力　トランプ政権のロシア疑惑
435,共同通信,5,地方議会の女性増に育休が有効　議長アンケート
436,WIRED.jp,5,地球温暖化で大雨が急増し、河川氾濫の被害は10倍に？ 新たな予測モデルで判明
437,朝日新聞デジタル,5,当選するたびスーツ新調３０万円　町議会が補助取りやめ
438,財経新聞,5,国内外の注目経済指標：8月米中古住宅販売件数は前月並みの水準か
439,共同通信,5,WADAのロシア処分解除を批判　米機関委員長「憂うべき」
440,朝日新聞デジタル,5,朝鮮戦争の終戦宣言「時期尚早」　日米高官が会談で一致
441,共同通信,5,世界経済、リーマン危機から回復　震源地、米国発のリスクも
442,共同通信,5,米国防長官、来月訪中へ調整　北朝鮮の非核化協議か
443,朝日新聞デジタル,5,称賛していた人まで…トランプ氏元側近、相次ぎ捜査協力
444,時事通信社,5,トランプ氏支持、下落の兆し＝無党派層が離反か－米中間選挙に影響も
445,ホウドウキョク,5,がん患者 過去最多に　大腸がんが胃がん上回る
446,ホウドウキョク,5,一転“ロシア疑惑”捜査に協力へ　元トランプ陣営選対本部長
447,京都新聞,5,都市部の地価上昇、鮮明に　「再びバブル」の懸念も
448,時事通信社,5,ＷＴＯ改革へ緊急協議を＝Ｇ２０貿易相会合閉幕
449,日本経済新聞,5,車検切れを自動読み取り　国交省が装置導入
450,Newsweek日本版,5,トランプ暴露本『Fear』が伝える本当の恐怖、もう日本も傍観者ではいられない
451,共同通信,5,中学暴力アンケ、一転見つかる　熊本・長洲町「存在しない」
452,共同通信,5,南北、監視所削減で進展か　緊張緩和、首脳会談の議題
453,共同通信,5,自民党員調査で安倍氏に投票するが55％
454,朝日新聞デジタル,5,枝野代表「ウォーターゲート事件に匹敵」　公文書改ざん
455,時事通信社,5,中国高速鉄道、香港へ＝２３日に全線開通
456,朝日新聞デジタル,5,米南東部のハリケーンで１２人が死亡　８０万世帯で停電
457,Reuters,5,米国、17日にも2000億ドルの対中追加関税発表の公算＝関係筋
458,共同通信,5,「非核化先行」説得見通し　韓国大統領、正恩氏に
459,共同通信,5,70歳以上、初の20％超え　高齢者人口が最多更新
460,時事通信社,5,台風２２号の死者２５人に＝地滑りで乳児も犠牲－比
461,時事通信社,5,南北首脳会談・識者談話
462,朝日新聞デジタル,5,トランプ氏、対中関税「第３弾」１７日にも　対象幅広く
463,朝日新聞デジタル,5,大阪・松井知事「３空港一体の議論を」　台風被害受け
464,朝日新聞デジタル,5,朝鮮中央通信「たわごとだ」　河野外相の発言を批判
465,時事通信社,5,南北融和の進展期待＝米政権にいら立ち－中国
466,共同通信,5,フィリピン、台風で25人死亡　ルソン島、土砂崩れで
467,共同通信,5,総裁選、社会保障制度改革で論戦　外交・安全保障政策でも激論
468,ホウドウキョク,5,安倍首相、石破氏　地方遊説スタート　自民党総裁選
469,ホウドウキョク,5,皇太子さま、ご帰国　フランス公式訪問
470,共同通信,5,フィリピン台風で25人死亡と大統領府
471,京都新聞,5,社説：待機児童　保育の「質」にも目配りを
472,朝日新聞デジタル,5,ダマスカスの国際空港、ミサイル攻撃受ける　現地報道
473,朝日新聞デジタル,5,南北首脳会談、先発隊が北朝鮮入り　生中継を準備へ
474,HuffPost Japan,5,熊本市長の大西一史氏「連休に北海道観光に行って」。被災した北海道への気遣いに感謝と賞賛の声
475,日本経済新聞,5,自動車立国に迫る危機　トランプ氏「次は日本」
476,朝日新聞デジタル,5,ネットのデマ、沖縄知事選に影　警戒強める各陣営
477,AFP,5,フランスでマクドナルド「閉鎖ではなく存続を！」 貧困地区で社会的役割
478,共同通信,5,北海道地震、観光損失292億円　宿泊キャンセル94万人
479,読売新聞,5,災害医療の司令塔、ＤＭＡＴ事務局の体制強化へ
480,NewsPicks編集部,5,100万人が強制収容所に。中国のウイグル弾圧にトランプは動くか
481,AFP,5,イスラエル軍、シリア首都にミサイル攻撃か
482,毎日新聞,5,終末期医療：延命中止、意思確認に力点　自民、新法検討
483,共同通信,5,対中関税17日にも発動表明　米大統領、税率10％に下げ
484,産経ニュース,5,新疆に強制的な教育施設　中国治安当局、存在認める
485,共同通信,5,キプチョゲが世界新で連覇　ベルリン・マラソン
486,共同通信,5,自民総裁選、地方創生で舌戦　ラストサンデーに両候補
487,時事通信社,5,英ＥＵ離脱、再投票を＝ロンドン市長
488,朝日新聞デジタル,5,高齢者３５５７万人　７０歳以上は総人口比初の２割超え
489,時事通信社,5,台風２２号の死者３０人に＝地滑りで乳児も犠牲－比
490,共同通信,5,首相、プーチン氏に直接反論　日本の領土原則説明
491,共同通信,5,長崎・対馬で日韓慰霊祭　市民ら、済州島虐殺70年
492,ホウドウキョク,5,安倍 VS 石破　きょうも地方で論戦　自民党総裁選
493,朝日新聞デジタル,5,杉田水脈氏への批判は「見当外れ」　新潮４５が掲載へ
494,共同通信,5,NYで日本、イラン首脳が会談へ　原油見据え関係維持
495,共同通信,5,安倍首相、イラン大統領と今月下旬に会談へ
496,時事通信社,5,サムスントップらも随行＝経済協力協議か－韓国大統領訪朝
497,共同通信,5,新体操、団体種目別フープで日本2位
498,時事通信社,5,台風２２号の死者５４人に＝地滑りで乳児も犠牲－比
499,朝日新聞デジタル,5,台風２２号、フィリピンで５９人死亡　香港でも被害
500,朝日新聞デジタル,5,進次郎氏、菅長官と知事選そろい踏み　総裁選には触れず
