,source,theme,title
501,朝日新聞デジタル,5,菅氏「基地返還が実行されないと県民は国を信用しない」
502,朝日新聞デジタル,5,南北首脳会談に韓国４財閥トップ同行　サムスンなど
503,共同通信,5,サムスントップも訪朝へ　南北会談、韓国は先発隊到着
504,共同通信,5,南北会談2日目に合意内容発表も　18日から開催
505,朝日新聞デジタル,5,観光産業を敬遠？　「ハワイ超え」の沖縄、気になる数字
506,共同通信,5,南北、軍事的緊張緩和で合意の見通し
507,時事通信社,5,日本、立場決定に時間かかる＝プーチン氏提案でロ報道官
508,ハフポスト日本版,5,石破陣営が安倍陣営に「干さないでね」　盛り上がらない総裁選の裏側で……
509,共同通信,5,最高裁判事候補、性的嫌がらせか　米、被害女性が実名で告発
510,共同通信,5,平和条約締結、首相の説明と相違　ロ報道官「本人からの反応なし」
511,時事通信社,5,政治活動、一部解禁＝来年の総選挙へ一歩－タイ
512,時事通信社,5,元選対議長が捜査協力＝トランプ氏に打撃－ロシア疑惑
513,WWD JAPAN.com,5,「ロレアル パリ」 × 「イザベル マラン」　エフォートレスなメイクアップコレクション
514,Reuters,5,米国、17日にも約22.4兆円の対中追加関税発表の公算＝関係筋
515,福井新聞オンライン,5,存続危機の逆境越えサウルコス連覇
516,AFP,5,米最高裁判事指名のカバノー氏、「性的暴行」被害者が公然と非難
517,時事通信社,5,「終戦宣言は平和の出発点」＝「核保有不要に」と北朝鮮
518,東洋経済オンライン,5,ふるさと納税は､制度見直しでどう変わるか
519,産経ニュース,5,【自民党総裁選】ネット討論会で憲法改正手続きめぐり議論
520,毎日新聞,5,防衛省：ＡＩが文書管理　探索漏れ防止　２１年度本格運用
521,東洋経済オンライン,5,お金があれば人の行動を縛れるという勘違い
522,東洋経済オンライン,5,東京都が｢英語オンリーの村｣を建設した理由
523,共同通信,5,農林水産の被害397億円　北海道の地震、林が崩壊
524,共同通信,5,多国籍軍に陸自派遣検討　シナイ半島の停戦監視
525,読売新聞,5,大阪北部地震で建物など被害額、最大１・２兆円
526,時事通信社,5,ロシアとトルコ、１７日に首脳会談＝シリア情勢を再協議
527,時事通信社,5,欧州金融に負の遺産＝英ＥＵ離脱で勝者ＮＹ？－リーマン・ショック１０年
528,Reuters,5,Ｇ２０貿易相会合、早急なＷＴＯ改革を訴え
529,ホウドウキョク,5,高齢者人口割合 過去最高　70歳以上 初の2割突破
530,Reuters,5,英ロンドン市長、ＥＵ離脱巡り2度目の国民投票実施を呼びかけ
531,ホウドウキョク,5,台風22号　中国南部上陸　フィリピンで死者59人
532,Reuters,5,中国の全国新築住宅価格、8月は前月比＋1.4％　2年ぶり高い伸び
533,共同通信,5,海自潜水艦、南シナ海初訓練　軍事拠点化進める中国けん制
534,共同通信,5,首相、日朝首脳会談実現に決意　拉致問題進展図る考え重ねて示す
535,共同通信,5,海自潜水艦が南シナ海で初訓練
536,Bloomberg,5,米中通商協議開かれない恐れ、中国が提案拒否検討－ＷＳＪ紙
537,日テレNEWS24,5,安倍氏５１％、石破氏４１％
538,共同通信,5,「統一へ新たな歴史」と平壌市民　首脳会談に期待、演出は見られず
539,Reuters,5,ＥＣＢ、適切な時期に利上げペースを明示すべき＝クーレ理事
540,Reuters,5,ユーロ圏ＣＰＩ改定値、8月は速報と変わらず前年比+2.0％
541,時事通信社,5,米最高裁判事候補に性的暴行疑惑＝高校時代、女性が訴え
542,時事通信社,5,自衛隊の南シナ海訓練に反発＝中国
543,時事通信社,5,米特別代表、韓国高官と再会談＝非核化・終戦宣言協議か
544,共同通信,5,総裁選「辞表出せ」発言で応酬　首相は不問、石破氏反発
545,朝日新聞デジタル,5,多国籍監視軍に陸自隊員の派遣検討　安保関連法の新任務
546,朝日新聞デジタル,5,米最高裁判事候補に性的暴力疑惑　「殺されると思った」
547,Reuters,5,英経済見通し、無秩序離脱なら「大幅に悪化」＝ＩＭＦ
548,朝日新聞デジタル,5,石破氏が銀座を練り歩き　総裁選、東京で初の街頭演説
549,共同通信,5,北朝鮮で国際商品展覧会が始まる　経済優先、海外との取引拡大図る
550,共同通信,5,海自潜水艦、南シナ海で訓練　軍事拠点化進める中国けん制
551,共同通信,5,平壌で18日、南北首脳会談　文氏、非核化へ米朝仲介
552,ホウドウキョク,5,安倍 VS 石破 直接対決!　自民党総裁選直前
553,ホウドウキョク,5,3回目の南北首脳会談　18日から
554,朝日新聞デジタル,5,安倍・石破両氏、テレビで論戦　人事やモリカケ問題語る
555,時事通信社,5,英外相が訪日＝ＥＵ離脱後の関係協議
556,時事通信社,5,南北首脳会談に期待＝中国
557,this.kiji.is,5,学生のAIへの意識、ネガティブが4割。「仕事を取られる」懸念が最多
558,共同通信,5,次期町長選は不出馬と前田氏
559,共同通信,5,校外活動中の児童8人体調不良
560,Reuters,5,インドネシア中銀、ルピア安定のため「慎重に」介入へ＝副総裁
561,共同通信,5,古墳群、世界遺産へ「一定理解」　ユネスコ諮問機関調査終え文化庁
562,共同通信,5,「人生100年時代」へ改革議論　経産省、産構審に新部会
563,ハフポスト日本版,5,杉田水脈氏の「生産性」発言を安倍首相が擁護「まだ若いですからしっかり注意しながら仕事して欲しい」
564,共同通信,5,麻生氏、農相への辞任圧力を擁護　自民総裁選で石破氏支援に
565,朝日新聞デジタル,5,セクハラ問題、みなかみ町長失職　２度目の不信任決議
566,Reuters,5,豪中銀、貿易摩擦は見通しに「大きなリスク」＝議事要旨
567,共同通信,5,パワハラ対策、年内に結論へ　法規制も視野に検討
568,共同通信,5,群馬県みなかみ町長が失職　セクハラ疑惑、再び不信任
569,Reuters,5,英ＥＵ離脱の交渉戦略、代替案必要　議会の離脱委員会が提言
570,共同通信,5,日米貿易協議は24日以降か
571,朝日新聞デジタル,5,斎藤農水相、圧力かけた人物は明かさず　「考えて発言」
572,共同通信,5,2度目の不信任案可決、みなかみ町長が失職
573,共同通信,5,午後3時半から南北首脳会談
574,朝日新聞デジタル,5,組長のため虚偽診断書　担当医、初公判で否認し無罪主張
575,リセマム,5,学童保育、2021年度まで25万人増で待機児童解消へ…新プラン策定
576,共同通信,5,シリア、総攻撃を当面回避　ロシアとトルコが首脳会談で合意
577,共同通信,5,中国、米へ6兆円規模の報復か　食料品や金属部品など
578,NHKニュース,5,24日から発動と発表 トランプ政権が対中国の第３弾制裁措置
579,共同通信,5,南北首脳、非核化を協議　平壌、金正恩氏出迎え
580,共同通信,5,仕事の過半数ロボットが担う　22年に7千万超の職が消滅か
581,ビジネス+IT,5,中国 製造業のデジタル戦略(後編)：インターネットプラス政策の狙いはGAFA対抗
582,Bloomberg.com,5,米政権、対中追加関税で一部アップル製品を対象外へ－関係者
583,ビジネス+IT,5,「カジノ法案」と言われている時点で失敗　日本でIRが定着しないワケ
584,朝日新聞デジタル,5,加計理事長とのゴルフ問われ　首相「将棋はいいのか」
585,AMP[アンプ] - ビジネスインスピレーションメディア,5,ZOZOTOWNの前澤勇作氏の次の舞台は「月」。アート・プロジェクトを携え民間人初の月周回へ
586,朝日新聞デジタル,5,正恩氏は休み休み、文氏は笑顔　オープンカーと歓迎演出
587,京都新聞,5,「仏教サロン」京都の市民団体立ち上げ　宗派超え気軽に法話
588,Diamond Online,5,日経平均は「トリプル」ボトム」、マザーズ指数は 「ゴールデン・クロス」を形成！　相場が上向いて きたこそポートフォリオを改善する絶好チャンス！ - 成り上がり投資術
589,時事通信社,5,観光客処遇が「人権侵害」＝中国、スウェーデン非難
590,時事通信社,5,米政権は「対等な対話」を＝キューバ議長
591,時事通信社,5,英離脱交渉、最終コーナーへ＝１９日からＥＵ非公式首脳会議
592,朝日新聞デジタル,5,米政府、難民の上限を年３万人に　前政権時は７～８万人
593,財経新聞,5,通商問題などを巡る米中対立は継続の可能性
594,Reuters,5,米国の一国主義・保護主義、世界経済に打撃＝中国商務相
595,ホウドウキョク,5,海自、南シナ海で潜水艦訓練　異例の公表　中国をけん制か
596,共同通信,5,浅利さんをミュージカル曲で追悼　帝国ホテルでお別れの会
597,ホウドウキョク,5,「65歳以上も働きたい」60代超が7割　職場に増える「シニア層」に働く人は?
598,朝日新聞デジタル,5,斎藤農水相発言、二階氏「改めて取り上げる必要ない」
599,共同通信,5,米中協議取りやめの公算と香港紙
600,ホウドウキョク,5,自民党総裁選　安倍首相×石破元幹事長　論戦
601,共同通信,5,奇跡の復興米が黄金色に、大阪　小学生ら稲刈り
602,共同通信,5,ミャンマー軍が迫害の「主犯」　ロヒンギャ大量虐殺意図か
603,財経新聞,5,マグニチュード10の揺れでも倒壊しない紫禁城の秘密
604,ハフポスト日本版,5,死を未来に変えるクォンタムリープ ~広がるアジャイルお節介
605,共同通信,5,年金、19年分の申告書発送　過少支給問題受け改善
606,時事通信社,5,性暴行疑惑で２４日に公聴会＝最高裁判事候補と女性が証言へ－米上院委
607,時事通信社,5,難民受け入れ、さらに引き下げ＝１９年度の上限３万人－米
608,Reuters,5,アイルランド国境問題、引き続き海上案に反対＝英離脱担当相
609,共同通信,5,中国、米と同時に報復関税へ　新たな対抗手段も
610,共同通信,5,米、難民受け入れ枠最低に　19年度、3万人に削減
611,Reuters,5,ＥＵ、ブレグジット交渉で11月合意を期待＝独外務省高官
612,NewSphere,5,「新メキシコ革命」なるか　次期大統領に寄せられる期待、不安
613,Reuters,5,英政府のアイルランド国境案、唯一信頼できる─英ＥＵ離脱相＝独報道
614,Reuters,5,貿易戦争、株・通貨への影響を注視する必要＝中国人民銀金融政策委員
615,時事通信社,5,柳条湖事件８７年で式典＝中国、対日批判抑制
616,ホウドウキョク,5,群馬・みなかみ町長の不信任決議案可決　“セクハラ疑惑”で...
617,リセマム,5,【中学受験】【高校受験】未来マップ中高受験相談会9/23
618,ホウドウキョク,5,3回目の南北首脳会談へ　“非核化”議論深まるか
619,共同通信,5,文韓国大統領、非核化へ説得　南北首脳、平壌で会談
620,ホウドウキョク,5,文大統領を金正恩氏が抱擁歓迎　空港で大式典
621,朝日新聞デジタル,5,米最高裁判事候補の性的暴力疑惑、女性が公聴会で証言へ
622,時事ドットコム,5,１８年基準地価、全国平均２７年ぶり上昇＝全用途、地方圏も回復傾向－国交省
623,時事通信社,5,米朝対話へ糸口模索＝南北首脳が会談開始
624,BCN＋R,5,話題のネックスピーカーとワイヤレススピーカーどれが売れている？　ワイヤレススピーカー　売れ筋ランキングトップ5！
625,Reuters,5,米中貿易戦争、20年続く可能性＝中国アリババの馬会長
626,時事通信社,5,１１月に臨時首脳会議へ＝英離脱交渉「決裂あり得る」－ＥＵ大統領
627,時事通信社,5,シリア沖でロシア軍機撃墜＝イスラエルに責任と非難
628,共同通信,5,仏内相、19年にも辞任意向　マクロン政権失速の印象強まる
629,共同通信,5,柳条湖事件87年で記念行事　対日関係改善で抑制対応
630,日本経済新聞,5,企業トップの後継者、選考計画文書化を　経産省新指針
631,朝日新聞デジタル,5,未払い残業代７００万円　裁量労働制不正適用で是正勧告
632,時事通信社,5,シリア沖でロシア軍機撃墜＝イスラエルに「原因」と非難
633,Reuters,5,離脱後の英移民制度、ＥＵ出身者を優遇すべきでない＝諮問委
634,Reuters,5,米中貿易摩擦、20年続く可能性＝中国アリババの馬会長
635,共同通信,5,自民総裁選20日投開票　安倍氏優勢、石破氏地方票に全力
636,NewSphere,5,先端技術で監視、思想矯正……強まる中国のウイグル族弾圧　国際社会は傍観
637,共同通信,5,大阪府北部地震から3カ月　住宅被害5万4千棟超える
638,朝日新聞デジタル,5,高官出席せず、対日関係重視か　中国で柳条湖事件の式典
639,ホウドウキョク,5,陸自　シナイ半島へ派遣検討
640,Reuters,5,日銀、金融政策の据え置き決定　長期金利の変動容認も維持
641,共同通信,5,中国首相、輸出促進のための通貨切り下げせず
642,リセマム,5,SSHの今後の方向性…高大接続枠を新設、減額や指定解除も
643,Reuters,5,米韓ＦＴＡ見直し案、国連総会中に調印も＝トランプ大統領
644,共同通信,5,中国首相「一国主義で問題解決できない」
645,朝日新聞デジタル,5,正恩氏がソウル訪問へ　南北会談、非核化の説得は難航
646,Reuters,5,アフリカの人口急増は世界の貧困抑制進展にリスク＝ゲイツ財団
647,ホウドウキョク,5,あす投開票　両候補が訴え　石破氏は“辞表圧力”批判
648,朝日新聞デジタル,5,日銀、金融緩和の現状維持を決定　景気「緩やかに拡大」
649,ホウドウキョク,5,南北首脳会談、きょう2日目　非核化は? 問われる成果
650,共同通信,5,消費税還元セールに反対　日商、中小にしわ寄せ
651,Reuters,5,英ＥＵ離脱反対派、国民投票再実施の方法提案　「まだ時間ある」
652,朝日新聞デジタル,5,竹島を「祖国」とする歌曲披露　南北首脳会談の歓迎公演
653,Reuters,5,伊副首相、経済相に辞任圧力かけたとの報道否定
654,Reuters,5,ＮＺの経常収支、第2四半期は予想上回る赤字
655,共同通信,5,日銀、金融緩和据え置き決定
656,共同通信,5,南北首脳が合意文書に署名
657,朝日新聞デジタル,5,マティス国防長官「報道、真剣に受け止めない」交代否定
658,AFP,5,米韓FTA見直し完了 トランプ氏、今月中にも署名用意ありと発言
659,共同通信,5,米、全輸入品に25％追加関税も　トランプ大統領、中国報復なら
660,共同通信,5,貿易収支、2カ月連続の赤字　8月、4446億円
661,読売新聞,5,北、ウラン施設破壊を打診…正恩氏の意向反映
662,現代ビジネス,5,この国で、地方移住がまったく進まない根本理由が分かった
663,朝日新聞デジタル,5,若い女性の妊婦判定費用、全額補助へ　未受診減らす狙い
664,NHKニュース,5,中国もアメリカへの報復措置発動へ
665,共同通信,5,金正恩氏、早期にソウル初訪問へ　非核化への意志も再表明
666,時事通信社,5,ロシア軍機撃墜「シリアの責任」＝イスラエル
667,時事通信社,5,日銀、大規模緩和を維持＝米保護主義はリスク要因
668,時事通信社,5,ロヒンギャ迫害、刑事裁付託を＝ミャンマー国軍が主導－国連調査団
669,時事通信社,5,ポーランドで米軍基地設置検討＝トランプ氏「ロシアは攻撃的」
670,時事通信社,5,先制サイバー攻撃も可能に＝中ロの脅威で、米新戦略公表
671,時事通信社,5,米アップル、１．９兆円全額納付＝アイルランドが追徴課税
672,Reuters,5,ロイター／ＩＮＳＥＡＤアジア企業景況指数、第3四半期は3年ぶり低水準
673,時事通信社,5,トランプ米大統領、「非常に興奮！」＝南北首脳会談を受けて
674,Reuters,5,中国、安定的な成長維持が一段と困難に　対外環境変化で＝李首相
675,朝日新聞デジタル,5,正恩氏、ソウル初訪問へ　南北会談、非核化は予断許さず
676,共同通信,5,南北首脳会談結果に「興奮」とトランプ氏
677,Reuters,5,中国、効果的投資促進へ　成長刺激目的では頼らず＝首相
678,Reuters,5,一方的な貿易措置、問題解決につながらず＝中国首相
679,ハフポスト日本版,5,出稼ぎの女の子たちの夢の後押し～ベトナム～
680,共同通信,5,中国首相、米一国主義批判　輸出促進の元切り下げ否定
681,産経ニュース,5,千葉市の受動喫煙防止条例が成立　罰則付きは市町村で初めて　飲食店原則屋内禁煙に
682,共同通信,5,トランプ氏「非常に興奮」　南北会談受け投稿
683,共同通信,5,公明・山口代表が6選確定　新執行部の人選焦点
684,ホウドウキョク,5,「近いうちにソウル訪問」　南北首脳 共同会見
685,共同通信,5,公明・山口代表の6選が確定
686,共同通信,5,南北首脳が北朝鮮最高峰の白頭山訪問へ
687,共同通信,5,私大に定員超過の罰則見送り通知　文科省
688,ホウドウキョク,5,私大定員超過で助成金減額見送り　受験競争激化で
689,時事通信社,5,告発女性、ＦＢＩの調査要求＝米最高裁判事候補の性暴力疑惑
690,京都新聞,5,ギフチョウとは
691,PRESIDENT Online：「仕事人×生活人」のための問題解決塾,5,橋下徹「総裁選で見えた進次郎氏の真贋」 - ギリギリの決断を下し説明できるか
692,共同通信,5,8月の訪日客257万人　地震、豪雨響き伸び鈍化
693,共同通信,5,アップル追徴課税1.9兆円納付　EUとの対立に区切り
694,時事通信社,5,北朝鮮、核施設廃棄の用意＝南北が実質「終戦」宣言－正恩氏、ソウル訪問へ
695,時事通信社,5,平壌宣言、「非常に興奮！」＝ミサイル施設の恒久廃棄評価－トランプ氏
696,時事通信社,5,北朝鮮非核化に「意味ある措置」期待＝米
697,AMP[アンプ] - ビジネスインスピレーションメディア,5,通勤電車内の過ごし方で“収入満足度”に差が出る？ビジネスパーソンの通勤電車事情の調査
698,リセマム,5,私大の入学定員、超過ペナルティ措置は見送り…文科省
699,共同通信,5,自民党総裁選、20日午後投開票　安倍氏、議員票の8割超獲得も
700,ハフポスト日本版,5,「この杉田水脈企画は『新潮45』のためにならない」　ベテラン編集者の思い
701,共同通信,5,アップル、EUの追徴課税1.9兆円納付
702,ホウドウキョク,5,南北首脳、「9月平壌共同宣言」署名　トランプ大統領も歓迎
703,共同通信,5,弁護士面会時の立ち会い違法　「拘置所、極めて重大な過失」
704,朝日新聞デジタル,5,公明・山口氏、代表６選確定「時代に合う新しい体制を」
705,Reuters,5,訪日外国人8月は災害で伸び鈍化、観光庁「マイナス影響を懸念」
